ticket_id,customer_id,created_at,status,issue_description,priority
1332,112,2024-10-01 18:02:23,in_progress,Information affect democratic meeting bed rule.,low
1333,359,2025-02-19 10:28:17,closed,Class more stand special exist.,high
1334,470,2024-10-08 17:48:45,open,Nor above measure alone trip late model similar.,medium
1335,165,2024-12-11 10:16:22,in_progress,Region look start think human doctor.,high
1336,453,2025-03-20 16:36:40,open,Grow already east data.,high
1337,364,2025-02-17 22:43:41,closed,Fine certainly far sound worry start.,medium
1338,335,2024-08-20 10:50:12,open,Remember same century most.,medium
1339,783,2024-11-08 17:31:53,open,Over teacher teach.,medium
1340,943,2025-05-09 23:27:45,open,Control understand fine month woman side main hospital.,medium
1341,388,2025-06-10 10:22:09,closed,Evidence college toward against floor worry traditional decision.,high
1342,766,2024-12-28 20:37:38,closed,Threat him here record though rest forget hotel.,medium
1343,323,2025-06-24 11:20:23,open,Owner trip produce start outside it region.,low
1344,545,2025-05-30 18:43:44,open,Ever over their them security treatment full.,low
1345,626,2025-03-31 03:29:21,in_progress,Box sound gun loss executive.,low
1346,709,2024-10-04 10:28:33,open,Able soldier expect.,low
1347,705,2024-11-30 04:36:34,open,Baby employee kind.,medium
1348,634,2024-12-05 18:35:37,in_progress,Network cell quality bag movement scientist.,low
1349,739,2024-10-16 02:48:45,open,Health specific exactly receive degree lose.,medium
1350,664,2024-10-20 11:25:39,closed,Quickly already good finish bill recently.,high
1351,647,2025-01-30 22:18:48,closed,Let conference suffer unit president start research how.,medium
1352,337,2024-07-18 13:44:20,closed,Federal water individual hospital difference behind me.,high
1353,732,2024-08-19 20:00:33,open,Writer performance opportunity head man particularly though should.,low
1354,300,2025-03-19 19:13:45,closed,Attorney science final past born.,low
1355,7,2024-11-08 16:03:28,in_progress,Economy effect charge entire music herself nice.,medium
1356,371,2025-07-04 18:07:44,closed,With summer quickly artist.,high
1357,197,2025-03-08 01:53:28,in_progress,Tend road she record staff.,low
1358,204,2025-02-17 17:00:03,in_progress,College office occur cost article.,low
1359,142,2025-03-16 16:16:29,in_progress,Rate walk it.,low
1360,903,2024-10-29 07:52:57,closed,Subject west agreement.,low
1361,912,2025-01-15 19:35:46,in_progress,Whatever financial small moment wrong.,low
1362,716,2025-02-14 05:53:02,closed,Chair writer boy war create air after wrong.,high
1363,313,2024-12-16 15:09:27,open,Simple wear college among.,low
1364,188,2025-05-18 07:56:48,in_progress,Peace also many real bag.,medium
1365,502,2024-11-30 20:25:04,open,Person Congress view choice not administration as.,medium
1366,932,2025-06-30 22:35:28,open,Picture movement under long financial thus.,high
1367,32,2025-02-03 01:16:23,open,Magazine idea exist according story east worry.,low
1368,837,2025-03-07 16:08:31,in_progress,Every and later during also husband paper charge.,high
1369,663,2024-10-01 04:54:41,open,School must pick explain training her.,low
1370,582,2024-10-10 17:39:02,open,Course stage Mr car case close door.,medium
1371,56,2025-03-21 16:39:34,in_progress,Than age discuss tell individual opportunity.,high
1372,418,2024-10-18 10:09:21,closed,And choose news else rule full.,medium
1373,542,2025-03-31 21:43:17,open,Item at health six it pass.,high
1374,568,2025-02-27 13:07:51,open,Civil clear hot glass trouble language sometimes.,low
1375,986,2024-08-09 08:07:27,closed,Recent voice economy police successful realize our kind.,high
1376,804,2024-09-21 22:23:12,in_progress,Bill anything key pay myself small indicate.,high
1377,277,2025-06-21 21:27:24,closed,With investment drive behind range nor behavior.,medium
1378,80,2025-04-20 04:28:59,in_progress,Together billion forget direction produce arrive.,high
1379,246,2024-11-25 11:27:11,in_progress,Before common network soldier group.,high
1380,126,2025-03-31 19:58:29,in_progress,Choose part town rule report.,low
1381,957,2025-01-07 05:07:51,closed,Moment out moment hundred.,medium
1382,839,2025-02-01 05:41:34,in_progress,Raise middle speech behind.,medium
1383,393,2025-05-07 04:54:49,closed,Seek kid stock financial.,high
1384,820,2024-11-01 16:24:26,in_progress,Drop budget sense create.,high
1385,114,2025-01-01 19:46:53,closed,Hold west maintain tax garden management ground play.,low
1386,503,2024-10-28 05:19:51,closed,As economic water young around produce oil.,medium
1387,950,2025-02-07 02:04:57,closed,Voice body life article guy.,high
1388,869,2025-05-24 19:53:00,closed,Music project fill reason way population.,low
1389,323,2025-06-11 12:02:04,in_progress,Effect although leave.,medium
1390,126,2024-12-25 05:23:19,open,Value challenge kitchen people impact pay air.,high
1391,589,2025-06-23 20:45:36,open,Factor explain what phone wear rather down.,high
1392,955,2024-12-11 21:35:32,in_progress,Work each player argue space amount choose.,low
1393,778,2025-02-08 23:57:02,in_progress,Positive morning great standard ok likely building theory.,medium
1394,677,2025-06-01 01:13:26,closed,Help real team get including most important meeting.,low
1395,779,2025-03-24 18:00:58,closed,Need similar old between opportunity financial never.,medium
1396,957,2025-03-10 18:10:09,in_progress,Leg day another degree play whatever thank middle.,medium
1397,876,2025-06-12 08:45:47,closed,Loss run necessary bad discussion send none.,high
1398,867,2024-10-11 21:46:21,closed,Town police effect later environmental.,low
1399,470,2024-12-18 18:46:24,open,Dream occur authority have.,low
1400,432,2025-05-13 08:16:43,open,Eat him often.,medium
1401,739,2025-01-07 12:42:55,in_progress,System laugh carry view painting military ready.,medium
1402,787,2024-11-19 15:12:17,in_progress,American rich player.,low
1403,492,2024-10-19 02:24:10,open,Believe owner tough after anyone owner.,low
1404,732,2025-02-24 04:45:43,in_progress,Approach production guy trip minute hair.,high
1405,604,2024-07-26 22:35:04,in_progress,Different even general against focus difference.,medium
1406,925,2024-12-10 22:48:40,open,Box fear enough front off action everybody four.,high
1407,533,2024-08-26 16:52:36,closed,Outside clear institution candidate statement family.,medium
1408,653,2024-10-31 02:45:33,in_progress,Trip official soon management network paper.,low
1409,207,2024-12-06 08:42:26,in_progress,Office everything war drop market.,low
1410,612,2024-10-05 06:25:32,open,Walk ok official.,medium
1411,65,2025-05-26 00:18:30,in_progress,Yeah out player professional dream sport action.,high
1412,749,2024-12-13 21:16:15,in_progress,Enjoy family general peace safe available writer.,low
1413,467,2025-01-16 02:56:57,open,Recent bill yourself store.,high
1414,36,2025-03-28 07:02:02,open,Glass want have media.,low
1415,970,2025-01-06 05:13:05,closed,Source ready actually movie near receive.,high
1416,429,2025-03-17 00:58:35,closed,Room anyone career public.,medium
1417,431,2024-12-11 11:28:05,in_progress,East morning population see major analysis common.,low
1418,299,2025-03-26 01:22:07,closed,Question cost go production religious purpose bit.,medium
1419,449,2024-09-05 07:36:55,open,Bit and run decision notice hotel than.,low
1420,777,2025-02-16 18:06:46,closed,Test several imagine yes clearly employee claim like.,low
1421,660,2025-02-01 22:50:23,in_progress,Paper others between billion any.,low
1422,94,2025-01-10 07:02:10,closed,Talk blood listen total.,medium
1423,750,2025-02-18 11:44:39,in_progress,Pass say recognize it scientist security.,low
1424,812,2025-06-15 13:19:05,open,Represent price spring expert body discuss soldier new.,high
1425,232,2024-08-14 03:31:49,in_progress,Call because us soldier approach color.,medium
1426,982,2024-09-25 07:06:54,in_progress,Yeah others much.,high
1427,156,2025-03-06 07:18:53,open,Great wide rate rest hospital.,high
1428,53,2024-10-06 21:32:09,in_progress,Argue when station.,low
1429,624,2024-08-25 01:44:04,in_progress,Will candidate crime hospital around move set.,low
1430,485,2024-12-13 20:25:43,open,Art become order away whom truth tree.,medium
1431,693,2024-10-04 22:19:53,closed,Person appear player heavy everybody.,high
1432,829,2024-12-13 21:29:49,in_progress,Possible take get never produce there.,medium
1433,266,2025-01-23 15:14:45,in_progress,Yet notice our unit through cover.,low
1434,16,2024-09-06 23:45:52,in_progress,Recognize accept dog learn.,low
1435,704,2024-09-07 06:10:43,closed,Leg truth receive participant.,low
1436,739,2024-09-11 11:51:00,open,Save heart community page finish light measure.,low
1437,616,2025-01-04 16:01:15,closed,Us list vote station.,low
1438,73,2024-10-03 23:17:22,in_progress,Cause rest still interest computer national magazine.,medium
1439,917,2025-01-30 10:05:41,open,Near surface building born marriage.,medium
1440,460,2025-04-14 06:10:15,in_progress,See gun piece couple change serious whom.,high
1441,945,2025-06-16 22:06:06,in_progress,And great learn range have military anyone.,low
1442,872,2024-09-20 02:47:59,open,Husband power tree baby ready collection become.,low
1443,768,2025-02-23 19:24:42,in_progress,Nation home Democrat than fill away.,high
1444,962,2024-10-05 19:35:31,in_progress,Anyone similar federal in.,medium
1445,816,2024-07-26 10:27:40,in_progress,Perhaps manager difference room response.,low
1446,235,2025-05-01 12:05:42,open,Water answer myself keep well.,high
1447,360,2024-09-08 11:22:34,in_progress,Receive quite leave usually.,medium
1448,365,2025-05-24 22:31:14,open,His subject card practice customer.,medium
1449,320,2024-10-27 06:59:15,closed,Find local fact.,medium
1450,376,2025-01-09 03:51:54,in_progress,Effect just such wonder.,low
1451,918,2024-10-17 23:48:15,open,Skin care side region nor.,medium
1452,273,2024-10-14 16:23:42,closed,Itself get something of.,high
1453,69,2025-02-23 02:34:16,open,Food laugh career let.,low
1454,591,2024-10-09 11:29:29,open,Serious capital ever yard job kitchen within relationship.,medium
1455,369,2025-03-10 20:38:25,open,Seat institution she across.,medium
1456,862,2024-08-05 01:00:19,in_progress,Certainly its field science.,high
1457,460,2025-03-29 09:06:34,closed,Cup development human.,medium
1458,772,2024-11-08 13:34:04,closed,Conference movement message service instead.,medium
1459,35,2024-10-21 20:49:15,in_progress,Save year Republican fight.,high
1460,454,2024-08-02 00:17:39,open,Send state already example nature.,medium
1461,767,2024-10-03 01:29:54,open,Every peace foreign common.,high
1462,580,2025-03-15 14:25:02,closed,Pass arm perform be crime his audience.,medium
1463,308,2025-07-02 07:48:15,open,Every when key special they.,medium
1464,155,2025-02-11 06:06:20,open,Occur green two strong.,medium
1465,663,2025-06-24 19:37:31,in_progress,Guess very game represent.,high
1466,442,2024-09-12 22:25:02,closed,Skill language pass everything.,low
1467,334,2025-06-28 00:32:15,in_progress,Return member piece well.,high
1468,974,2025-05-15 11:19:45,closed,Chair whom one me.,medium
1469,172,2025-06-13 13:31:06,open,Career than play fish pass.,medium
1470,232,2024-10-13 14:41:24,in_progress,Front range reach health.,high
1471,971,2025-01-31 18:17:21,closed,Last against truth degree environmental these say.,high
1472,17,2025-02-20 20:49:04,in_progress,Factor generation unit so early car.,high
1473,386,2025-06-19 12:40:07,open,Understand machine picture tree TV pay.,high
1474,35,2024-09-16 19:12:55,closed,Huge condition you general ten pretty partner.,low
1475,856,2025-07-04 10:09:20,open,Large morning chair left.,medium
1476,46,2024-09-26 16:37:09,closed,Value machine site.,high
1477,586,2024-09-19 00:40:19,closed,Safe parent drop event.,medium
1478,565,2024-09-02 02:48:51,open,Decision scientist it by choice toward.,medium
1479,35,2025-03-12 13:55:50,closed,Early receive body hope.,high
1480,48,2024-09-05 08:26:08,open,Type student chair charge policy shoulder body.,high
1481,282,2024-11-25 15:59:37,in_progress,Crime society walk argue some.,medium
1482,536,2025-03-17 22:25:39,open,Dark for current rise degree hundred resource pattern.,medium
1483,20,2025-05-08 18:01:44,open,Ago book order east you heart policy provide.,low
1484,362,2025-03-11 04:50:50,in_progress,Consider billion authority sport raise body.,low
1485,791,2024-12-03 10:11:18,in_progress,Cold pay fund red almost tonight page.,medium
1486,390,2025-07-08 16:54:19,in_progress,Take return lead group age.,low
1487,245,2025-03-27 15:39:35,in_progress,Program that quality deal.,high
1488,850,2025-07-10 21:46:51,in_progress,Most according authority doctor total whom officer.,medium
1489,608,2025-01-24 17:48:10,in_progress,Ever state recent.,high
1490,295,2024-07-30 15:34:00,closed,School hold question situation theory safe writer.,high
1491,546,2024-12-15 02:12:13,open,Feel draw then will grow cup drug.,medium
1492,108,2025-04-19 08:35:28,in_progress,Building business wonder from.,high
1493,729,2024-08-07 05:21:33,closed,Win detail PM close usually work.,medium
1494,347,2025-06-05 13:58:46,in_progress,Common land look day traditional science minute site.,low
1495,729,2025-05-23 23:24:40,open,We really modern ago.,high
1496,818,2025-06-09 18:07:43,open,Few radio particular least performance everything.,high
1497,530,2025-06-02 05:32:39,open,Rock network significant cell reduce.,high
1498,954,2025-04-27 16:11:26,open,Help eat back make.,high
1499,500,2024-10-25 20:30:45,closed,Add occur ten better easy quality.,high
1500,203,2024-08-25 01:48:38,in_progress,Attack power indicate year magazine.,low
1501,789,2024-11-15 10:44:46,open,Radio easy end stuff usually foot.,high
1502,917,2024-09-25 10:39:48,in_progress,Race nation blood agent several save.,low
1503,852,2025-01-07 18:13:47,in_progress,Health threat traditional paper customer admit sign.,high
1504,445,2025-05-04 13:37:10,closed,Open get son player because over foreign.,high
1505,86,2024-08-28 15:26:26,closed,Note full resource from possible doctor.,high
1506,734,2025-06-30 15:59:49,in_progress,Space program forget black she.,high
1507,120,2024-08-31 23:08:46,closed,Player outside edge amount war.,low
1508,92,2025-07-03 23:26:54,closed,Talk report fish black room research play.,high
1509,507,2024-10-18 09:07:40,in_progress,Field good former similar different run.,low
1510,663,2024-12-29 07:52:26,closed,Total your base field.,medium
1511,101,2024-10-11 07:28:34,in_progress,Clear and capital medical understand argue opportunity.,high
1512,993,2025-01-14 11:05:21,open,Debate no charge particularly.,low
1513,630,2025-03-21 17:45:37,closed,Town follow the yeah activity.,medium
1514,891,2024-08-26 07:53:44,open,Record rich if hour buy might audience.,medium
1515,513,2024-11-26 01:30:52,open,Art none visit view mean.,medium
1516,204,2025-01-30 19:51:43,closed,Me worry against.,high
1517,611,2025-05-24 17:16:12,open,Federal check increase miss apply contain.,high
1518,225,2025-04-11 16:43:14,in_progress,Cell energy she say will.,high
1519,490,2024-12-31 01:03:04,open,Reduce fund by thus police.,medium
1520,845,2024-12-31 20:59:24,open,This success training audience technology effort.,medium
1521,94,2024-09-21 00:00:50,in_progress,Hold pull maybe vote data.,medium
1522,441,2025-04-25 19:20:25,open,Our forget with together season.,high
1523,701,2024-11-26 22:39:06,in_progress,Leave open along small.,high
1524,329,2025-04-16 15:32:12,in_progress,Since itself not full rise avoid.,high
1525,756,2024-12-26 18:58:49,closed,Receive among coach market career.,medium
1526,123,2025-06-11 17:34:02,closed,West long enough on.,medium
1527,986,2025-04-16 15:18:29,open,Subject evidence city.,low
1528,2,2025-06-26 05:48:09,open,Big character social environment boy edge.,high
1529,358,2024-08-11 13:13:56,closed,Charge eight true.,low
1530,805,2024-07-26 23:16:50,closed,Debate play what relationship huge news soldier policy.,high
1531,844,2024-10-31 09:05:23,in_progress,Somebody situation author continue.,low
1532,132,2025-05-04 14:15:02,closed,Offer firm face prepare.,high
1533,69,2025-01-24 18:34:47,closed,Maintain from truth talk.,low
1534,69,2024-09-13 08:05:31,open,Spring something can skin.,low
1535,157,2025-01-11 13:08:18,in_progress,Scene structure line government.,medium
1536,335,2024-11-13 23:16:34,closed,Price black mission.,medium
1537,159,2025-03-10 12:03:46,closed,Commercial anyone meeting.,high
1538,643,2025-06-19 14:19:34,in_progress,Then here single reveal week standard family.,low
1539,198,2024-11-22 12:03:08,open,Family good factor difference one.,medium
1540,118,2024-12-22 15:20:52,closed,Image executive small.,medium
1541,514,2025-03-29 18:24:03,open,Here future should street necessary.,high
1542,226,2024-10-14 06:42:49,in_progress,Meeting account better others.,high
1543,353,2024-11-15 13:08:01,in_progress,Accept early play finish half research police.,low
1544,325,2024-11-28 10:12:13,in_progress,Same for hit me style return.,high
1545,286,2025-05-30 11:19:32,open,Total seem media month effort.,high
1546,138,2025-01-18 11:17:30,in_progress,Family amount rock or these put.,high
1547,844,2024-09-10 12:21:08,closed,Spend million ago state boy however north.,low
1548,88,2024-12-06 06:59:15,closed,Person network forward magazine.,medium
1549,230,2024-11-01 19:50:02,in_progress,Finish into each teacher.,high
1550,762,2025-04-13 13:35:07,closed,Environmental local something every often set modern.,high
1551,856,2025-01-04 06:25:21,open,Thing newspaper place behavior final.,medium
1552,812,2025-06-21 09:43:15,closed,Heart should rate account company trouble.,high
1553,941,2025-02-26 11:58:32,open,Team offer action goal somebody create tend.,medium
1554,145,2024-09-07 18:46:27,closed,Audience activity these dream.,high
1555,347,2025-01-18 00:42:24,in_progress,Democrat real agree skill go or.,low
1556,354,2025-04-05 18:54:39,open,Us water study whatever hand.,low
1557,708,2024-11-16 19:32:34,closed,Value different issue Republican officer others.,high
1558,383,2025-01-09 17:05:37,open,Smile admit offer his.,medium
1559,427,2024-09-13 06:42:51,in_progress,Check late run color late good church.,medium
1560,544,2025-05-30 00:06:24,in_progress,Me see wall year.,low
1561,717,2025-03-01 09:36:01,in_progress,Onto play financial them lawyer plan finish people.,high
1562,596,2024-08-05 14:34:04,open,Process itself degree write out.,medium
1563,923,2024-11-07 12:28:23,closed,Information director born Republican doctor.,high
1564,541,2025-02-09 06:18:24,closed,Our but director measure.,low
1565,850,2024-08-25 13:12:07,in_progress,Teach blue focus.,low
1566,773,2024-09-03 14:53:35,closed,Enough protect fill science fear.,high
1567,493,2025-05-06 06:43:59,in_progress,Recently common same as hear feeling only.,medium
1568,716,2025-05-01 01:45:52,open,Effect specific trip pretty nice age piece spend.,medium
1569,710,2025-06-12 04:59:15,in_progress,Study military bank song however front analysis.,high
1570,114,2025-05-14 00:48:21,open,Spring see without style painting in.,high
1571,753,2025-04-22 22:38:48,closed,Yes serve wait tough offer suggest word machine.,low
1572,931,2024-07-13 18:31:19,in_progress,Understand central some themselves.,low
1573,529,2024-12-15 17:56:17,open,Energy crime effect serious thus.,low
1574,178,2024-08-30 23:17:33,closed,Girl anyone likely how.,low
1575,380,2025-03-08 09:29:29,open,Air necessary new tree.,low
1576,640,2025-04-14 19:25:46,in_progress,Seat note door population.,medium
1577,861,2025-05-20 22:08:45,closed,Learn mean use seem lay foot.,medium
1578,747,2025-04-16 22:20:10,in_progress,Wife food next south enter.,high
1579,745,2025-06-14 17:36:38,closed,There seven PM.,low
1580,346,2025-05-01 02:11:55,open,Development rate against.,medium
1581,930,2024-11-09 14:34:57,in_progress,Push year statement lead against natural mission.,low
1582,957,2024-09-27 05:39:02,in_progress,Expert though big federal bank stock.,high
1583,930,2025-06-29 23:06:07,in_progress,Could protect hope like item name.,high
1584,234,2024-07-28 03:07:20,open,Ready but with relationship onto.,low
1585,442,2024-10-09 13:31:41,in_progress,Understand medical boy above plant.,low
1586,202,2025-07-10 19:28:00,closed,Worker everything chair matter seven charge nation simple.,high
1587,378,2025-05-15 05:44:20,in_progress,During edge week away protect.,low
1588,425,2024-07-28 18:36:03,closed,Wind economic prevent range wait sit.,low
1589,550,2025-06-10 08:06:58,in_progress,Media debate wall American medical edge third.,low
1590,716,2025-04-15 02:16:55,open,Though health television reach.,high
1591,757,2025-06-21 05:25:10,in_progress,Performance market top must catch.,medium
1592,686,2024-08-13 04:26:37,in_progress,Into candidate toward commercial white across enjoy.,medium
1593,171,2024-09-29 01:50:37,in_progress,Address reality any daughter size interesting.,high
1594,786,2025-07-05 17:57:33,in_progress,Nature occur people indicate.,high
1595,498,2024-11-29 09:27:34,open,Pick point season heavy.,low
1596,801,2024-10-07 18:10:58,closed,Develop race else reality turn support popular.,low
1597,666,2025-03-22 14:41:23,open,Seat test help your everything.,medium
1598,894,2025-04-16 23:49:36,in_progress,Apply news who environment him it reality.,high
1599,528,2025-03-24 22:21:19,in_progress,Take newspaper site health hot feel.,low
1600,152,2024-08-01 10:00:20,in_progress,Rather central hour ok peace.,low
1601,148,2025-05-25 23:37:19,open,Call production step street.,low
1602,697,2024-12-04 04:28:43,closed,So run shake admit.,high
1603,61,2025-01-20 17:55:18,open,Boy character team.,low
1604,743,2024-08-02 09:33:20,in_progress,Local music help.,low
1605,591,2025-05-07 08:01:35,open,Indicate wrong hotel sometimes stuff wish focus.,low
1606,422,2024-12-08 10:38:38,open,Interest approach where break around million point.,medium
1607,365,2024-12-29 04:54:33,open,Attack herself contain rate step.,low
1608,372,2024-12-21 21:03:59,open,Newspaper half radio while.,high
1609,370,2025-05-03 11:32:19,in_progress,Card feel use age page may outside.,low
1610,813,2024-07-21 20:04:28,open,Most particularly inside class meet something.,high
1611,67,2025-05-30 19:52:38,open,Serious go might international.,medium
1612,485,2025-06-15 08:42:57,open,Attorney although capital final.,high
1613,210,2025-02-25 12:45:47,in_progress,Job way conference a.,high
1614,596,2024-11-15 09:52:24,open,Born thank choice offer.,high
1615,360,2024-11-21 05:43:30,closed,Garden purpose speech career pull together.,medium
1616,985,2025-05-24 12:50:48,open,Full during part moment each expect some.,high
1617,266,2025-01-26 06:38:38,closed,Effect issue realize last cold.,high
1618,644,2025-03-19 18:46:56,open,News price teacher entire individual lose outside.,high
1619,297,2025-02-07 18:40:52,open,Day use where how admit.,medium
1620,839,2024-08-01 20:54:53,open,Alone nation white decide million.,high
1621,126,2025-02-15 17:32:46,in_progress,Instead investment feeling.,medium
1622,488,2024-10-19 20:07:38,in_progress,Necessary night authority interview husband institution help.,medium
1623,562,2024-10-31 09:29:34,closed,Positive then often.,low
1624,627,2025-05-01 18:14:31,open,Take authority Mr region town on.,high
1625,561,2025-07-10 23:56:58,in_progress,Course green nor individual night.,low
1626,420,2024-09-17 04:57:26,closed,Address need sister various.,high
1627,43,2024-07-21 02:23:16,open,Get middle case dream.,low
1628,102,2024-09-13 07:43:13,open,Effort analysis game now Mr eight.,low
1629,14,2024-09-18 06:11:22,in_progress,International yeah record base enter agent but music.,low
1630,686,2025-06-18 13:22:19,open,Half effort billion word can worry meet.,medium
1631,449,2024-12-16 14:19:47,closed,Wish after member participant.,high
1632,828,2024-09-16 20:05:16,open,Address pass this international.,high
1633,571,2024-10-30 15:26:27,open,Others court send way leader security.,low
1634,510,2025-02-05 07:55:38,closed,Oil nature policy matter light.,high
1635,395,2025-01-23 21:38:20,closed,Challenge rise level me sign stay.,medium
1636,758,2025-03-11 23:35:02,closed,Always attack financial nature.,low
1637,828,2024-09-22 19:08:50,closed,Ever accept movement find true.,low
1638,343,2025-06-22 03:53:32,in_progress,Argue site represent its television end until resource.,medium
1639,790,2025-04-02 02:56:10,in_progress,Family air somebody feel trial above.,high
1640,717,2024-12-16 21:34:50,closed,Stock past red.,low
1641,899,2025-07-03 13:04:20,open,Animal raise song network could.,medium
1642,932,2024-12-25 11:24:18,in_progress,Career kitchen detail.,medium
1643,88,2025-04-28 10:13:47,open,Third money address.,medium
1644,24,2025-05-19 10:59:44,in_progress,City administration cold somebody ready world.,high
1645,21,2024-07-19 19:58:26,in_progress,Sit glass future those project.,low
1646,387,2025-02-15 19:09:27,in_progress,Probably same plan father style action.,high
1647,351,2024-11-01 12:46:44,open,Maybe cause forward tough sell bed support teacher.,medium
1648,420,2025-02-27 17:16:29,open,Party pick follow stuff easy deal upon.,high
1649,331,2025-06-14 03:01:20,open,Everyone green claim let.,high
1650,908,2025-04-07 01:50:02,in_progress,Once we national home.,high
1651,894,2025-06-08 19:38:34,open,Thank last federal analysis.,medium
1652,121,2024-10-02 22:52:17,open,Either according degree hour major author according.,medium
1653,332,2024-10-16 09:50:26,open,Like room important.,high
1654,732,2024-07-21 17:19:52,closed,Focus talk technology prevent hope every.,low
1655,213,2024-08-20 18:32:21,in_progress,Bed least most miss.,medium
1656,546,2024-08-02 07:01:31,in_progress,After both build point different.,medium
1657,501,2025-04-25 06:25:50,in_progress,Necessary military strategy character character third any two.,high
1658,163,2024-10-11 19:51:18,in_progress,Himself executive field thus myself.,high
1659,344,2024-10-22 14:59:04,in_progress,Interesting goal shoulder plant.,medium
1660,593,2025-04-05 06:21:11,closed,Pick heavy cover popular population bed.,low
