ticket_id,customer_id,created_at,status,issue_description,priority
1,627,2024-08-13 12:08:07,closed,Enjoy last best worry as.,medium
2,206,2024-07-18 05:00:18,closed,Cultural kind pass event perhaps.,high
3,963,2025-03-19 05:50:07,in_progress,Imagine parent factor American team law actually.,medium
4,685,2025-06-23 22:32:49,in_progress,Plan conference lay history.,high
5,306,2025-05-29 14:29:43,in_progress,Wear recognize station fly.,high
6,629,2024-11-25 17:36:30,closed,Party accept east serious cause.,high
7,781,2024-08-15 17:08:11,in_progress,Owner believe sound Republican perhaps look.,medium
8,270,2025-01-02 13:55:52,in_progress,Indeed Congress reason Mrs.,low
9,484,2025-03-04 22:33:49,closed,Middle plan resource fall go bank.,medium
10,726,2025-05-04 09:54:29,closed,Character example claim ability movement.,high
11,332,2024-08-19 12:52:23,in_progress,Condition use true.,low
12,712,2025-02-04 23:45:28,closed,Up picture up.,low
13,400,2025-02-19 21:19:13,in_progress,Day since born role.,medium
14,999,2024-11-08 13:37:49,closed,Strong loss them security year answer.,low
15,14,2025-05-09 07:08:28,closed,Both mind leg religious chance decade listen.,low
16,561,2024-12-08 04:13:18,closed,Actually home would.,medium
17,907,2024-10-14 20:09:46,open,Hold past organization hair make.,high
18,248,2025-07-06 14:30:05,open,Property color how third.,low
19,981,2024-10-08 08:11:27,open,Move strategy step conference.,high
20,317,2025-05-25 23:12:48,in_progress,Gas growth employee team.,medium
21,968,2024-07-27 20:57:38,in_progress,Prevent section report child approach.,high
22,248,2024-07-19 08:35:09,open,Executive music fire they.,low
23,11,2024-08-07 16:38:34,in_progress,Price suddenly by performance bank.,high
24,933,2025-04-17 04:14:32,in_progress,Throughout until value particularly.,high
25,113,2024-12-22 18:56:16,open,Become exist too before military.,low
26,307,2025-05-20 03:05:38,open,Control anything customer peace.,medium
27,505,2024-12-04 16:32:58,open,Gun step better card.,low
28,548,2025-05-27 20:10:03,in_progress,Try specific candidate century security.,low
29,244,2025-06-29 10:44:51,closed,Data moment seat bill say.,low
30,384,2024-07-20 22:19:45,closed,State side major.,low
31,954,2025-03-29 11:57:14,in_progress,Quite fast air letter.,low
32,882,2025-02-22 19:24:41,closed,Some wife sign point.,low
33,492,2025-03-31 04:03:57,closed,Shake before three war own rock occur.,medium
34,656,2025-03-27 13:32:32,open,Point beat social head.,low
35,70,2024-12-31 06:54:42,closed,Data kind establish single win plant next.,high
36,638,2025-06-21 11:02:39,closed,Decision create true arrive wind reason.,high
37,935,2024-08-20 11:04:27,open,Maybe former plant scene send but degree.,medium
38,16,2025-04-27 19:35:35,open,Game these member sea.,high
39,69,2025-03-04 19:30:31,in_progress,Theory offer evening.,high
40,201,2024-10-16 21:07:35,open,Response sit apply same commercial body.,low
41,741,2024-08-15 12:47:55,closed,Process mind four home writer common treat.,low
42,302,2025-02-03 09:59:47,open,Wish call meeting open represent.,high
43,353,2025-03-19 12:56:05,closed,Good friend agent hard same on allow traditional.,low
44,11,2025-04-17 22:43:06,open,Need daughter field cause trip oil bad.,low
45,611,2024-09-16 09:05:11,in_progress,Protect point avoid road.,low
46,49,2025-02-10 11:57:03,open,Standard prepare south room prove.,medium
47,720,2024-09-20 05:16:35,open,Personal edge reality personal travel suggest.,medium
48,781,2025-06-14 18:49:56,in_progress,Investment stand our room.,high
49,535,2024-08-15 00:30:04,open,Despite none give history lose month democratic.,low
50,223,2024-07-15 09:03:30,closed,Involve set small church suggest word.,low
51,712,2024-12-16 21:16:24,closed,Apply medical cold reflect poor station gun.,low
52,569,2025-04-22 04:38:55,closed,Sign rather vote even community situation drug.,low
53,970,2025-04-18 06:20:13,open,Church tell treatment position four special.,high
54,838,2024-12-21 23:33:26,closed,Mother argue interesting share cultural Mr likely.,medium
55,687,2025-03-23 03:16:10,open,Civil class right suffer according.,low
56,409,2024-07-12 16:39:52,in_progress,Business conference several base lawyer energy wrong.,medium
57,658,2025-07-09 09:09:56,open,According watch tell parent question management.,high
58,108,2025-03-03 18:48:18,in_progress,Hit century opportunity.,high
59,556,2025-03-15 04:38:27,closed,Eat story director chair.,medium
60,277,2024-11-13 21:37:11,open,Movement anyone remember item summer minute relate form.,high
61,343,2025-03-26 16:47:01,closed,Spend deal his either each capital lay.,low
62,631,2025-05-03 02:34:51,open,Him begin name imagine.,high
63,887,2025-03-15 03:18:20,in_progress,Trouble sound item our way growth.,medium
64,342,2025-06-28 11:55:38,closed,Here if pick resource yeah performance paper.,low
65,896,2024-11-02 11:04:11,closed,Amount when still education direction allow significant.,high
66,102,2025-06-04 10:35:34,open,Even human sing course sit interesting against.,low
67,418,2024-08-24 17:05:55,open,Line reduce bar significant want start.,low
68,517,2024-08-25 00:27:17,closed,Newspaper continue everything.,medium
69,722,2024-10-07 10:22:08,in_progress,Page method store American phone.,high
70,732,2025-02-16 09:36:02,closed,Start situation church activity allow how.,medium
71,862,2024-08-28 05:08:56,open,Process onto method nation approach thing tell six.,low
72,719,2025-05-26 22:07:03,open,Player pass finish bank.,low
73,364,2024-12-13 03:05:46,in_progress,Represent public establish exist interview.,medium
74,346,2025-02-24 04:04:05,open,Scene time opportunity industry.,low
75,156,2024-11-25 10:54:05,closed,Current course drive production citizen.,low
76,9,2025-06-09 21:17:58,in_progress,Require outside argue performance serve decade.,medium
77,319,2025-04-16 04:45:23,open,Understand ever win nearly effort.,low
78,573,2025-03-24 00:44:47,open,Prove radio include fall enough number particular forward.,high
79,849,2025-04-26 12:42:33,open,Or try on capital we answer.,high
80,341,2025-02-25 19:16:49,closed,Us expert music drug source.,low
81,573,2025-04-17 00:05:19,open,Anyone give short we.,medium
82,378,2024-12-12 06:34:15,closed,It give across old few her boy officer.,low
83,659,2024-11-16 05:25:17,open,Else participant fund learn above.,low
84,289,2024-12-17 19:11:36,closed,Leg free language security simply structure.,low
85,287,2025-03-30 19:19:57,closed,Over decide suggest like guy.,high
86,223,2024-07-24 04:03:20,in_progress,Such let customer eye call husband less.,medium
87,340,2024-12-31 22:38:46,in_progress,Enough per bag it major where child.,high
88,256,2025-06-12 18:00:02,open,Hand commercial green test onto take draw his.,medium
89,30,2025-05-28 22:17:29,closed,Church debate hair certainly already debate shake.,high
90,318,2025-01-30 13:40:53,closed,Bill whole certain remember deep.,medium
91,46,2024-08-26 18:06:39,in_progress,Nor option technology team entire door.,medium
92,817,2024-11-20 16:28:24,in_progress,Fact officer home account.,low
93,257,2025-03-02 08:29:07,open,Knowledge firm century over speak energy.,low
94,366,2024-08-14 17:37:38,in_progress,Ball reveal then long appear be look.,medium
95,746,2025-01-27 23:29:30,in_progress,Guy official as natural name but space career.,low
96,865,2024-08-24 04:56:29,in_progress,Car board probably American or.,medium
97,811,2024-09-22 02:46:48,open,Without operation inside author.,low
98,239,2024-09-26 07:02:26,in_progress,Too effort among generation her.,high
99,497,2024-10-27 09:13:59,closed,Our store owner most we computer.,medium
100,700,2025-04-21 04:45:08,closed,Simple benefit claim choose peace.,low
101,746,2024-11-23 23:40:42,open,Ready there bring market accept now.,low
102,253,2024-12-11 19:42:45,closed,Professional win pull least even better hospital.,low
103,204,2025-06-21 02:05:04,in_progress,Beyond science else fire suffer employee.,medium
104,757,2024-09-28 06:36:23,in_progress,Organization set eye state sometimes accept.,medium
105,977,2024-07-16 23:25:12,open,Know something actually government can.,medium
106,436,2024-10-12 01:48:25,in_progress,Enjoy win class deal plant.,high
107,891,2025-05-10 07:29:41,closed,Foreign control station include behavior leave.,low
108,825,2024-09-28 18:57:45,open,Believe of certain use enter.,low
109,405,2024-07-18 19:35:47,in_progress,Character quality claim difficult budget employee.,high
110,446,2024-11-16 22:35:30,closed,There believe fly red but.,low
111,563,2024-07-20 13:14:19,closed,Account any under policy marriage.,medium
112,962,2024-11-12 23:01:48,in_progress,Anything impact friend leave important.,medium
113,52,2025-04-17 04:16:44,in_progress,Partner want she resource cold ok yes.,high
114,221,2025-06-13 12:25:41,in_progress,Keep morning station hotel.,low
115,328,2024-08-31 03:41:04,closed,Place individual identify town.,medium
116,738,2024-12-04 02:22:08,in_progress,Politics nearly study collection.,medium
117,746,2024-10-13 18:04:53,closed,Probably TV right notice home through.,medium
118,226,2025-07-03 14:37:12,open,Community take staff who.,high
119,658,2025-04-15 11:30:58,closed,Institution put than shake task two find.,high
120,216,2024-11-05 13:28:12,closed,Address hour start most.,medium
121,785,2025-02-06 19:26:31,in_progress,Power data certainly various.,low
122,492,2025-01-01 06:06:05,open,National population anything admit audience but his surface.,medium
123,628,2024-09-07 10:13:20,open,Executive while cup commercial voice season country.,high
124,781,2025-06-18 01:04:00,in_progress,Real military standard score admit moment.,low
125,964,2025-06-07 11:03:43,closed,Create eat commercial great.,high
126,524,2024-10-01 19:11:44,open,Condition performance way southern prepare able.,low
127,774,2025-04-27 01:35:44,open,Program more environment baby truth into.,medium
128,822,2025-04-23 22:24:55,closed,Again doctor out party.,medium
129,361,2025-05-15 22:31:41,closed,Matter respond sit doctor share think.,low
130,101,2025-01-01 11:19:22,in_progress,Information enjoy discussion would when business recognize.,high
131,361,2025-06-09 09:25:33,open,Know information for school imagine house.,high
132,943,2025-04-11 11:53:29,closed,Note she authority line force record.,low
133,559,2025-04-21 13:23:33,open,Mr behavior possible piece.,low
134,695,2025-03-27 05:14:31,closed,Scientist old performance nice ten old professional.,medium
135,957,2025-05-28 18:35:37,open,Add change station.,medium
136,213,2024-08-27 06:24:36,open,Get think fund left receive need.,low
137,961,2025-03-22 10:49:05,open,Hospital picture management someone hard when technology contain.,medium
138,970,2024-11-15 20:03:57,open,Human artist pretty be care these.,medium
139,418,2024-11-21 09:53:47,in_progress,Management five strategy draw race line.,low
140,7,2024-11-16 14:01:19,closed,Other weight happy among know culture.,high
141,383,2024-12-13 12:19:25,in_progress,Mrs deep prove wife travel music fine writer.,medium
142,217,2025-06-05 15:40:59,open,Maybe add owner.,medium
143,833,2025-03-11 06:09:12,closed,Interest everything keep discussion culture.,low
144,47,2025-03-13 10:42:59,open,Worker cup price time politics scientist.,medium
145,268,2025-02-04 15:45:05,open,Not which now total.,low
146,613,2024-09-02 15:58:13,open,Can treat field candidate.,high
147,596,2024-10-26 04:42:17,closed,Better successful why ago treat.,low
148,876,2024-09-17 16:52:51,closed,Hit laugh TV five government.,low
149,784,2024-07-18 17:22:49,open,First you pass.,medium
150,435,2025-03-22 16:52:44,in_progress,Spring economy throughout skill record structure.,high
151,303,2024-12-10 14:38:35,in_progress,World think ready section statement.,low
152,289,2025-03-22 15:32:16,closed,Your president will leave writer force difference wear.,medium
153,343,2025-03-15 09:14:14,closed,Describe yet piece body.,low
154,909,2025-07-03 17:33:53,in_progress,Sort industry bar us.,high
155,718,2024-07-19 06:45:50,closed,Picture until recognize would turn.,low
156,358,2025-01-30 18:29:23,closed,Bill chair future cover site.,high
157,905,2024-11-28 09:14:23,in_progress,Yeah light son already report require.,medium
158,569,2025-04-04 11:45:25,open,Practice take during environment.,low
159,403,2025-01-27 12:57:17,in_progress,Benefit two form letter behavior cold.,high
160,420,2025-04-23 08:38:55,in_progress,From draw film me value like.,medium
161,347,2025-01-15 06:16:08,in_progress,Take form interview play up speech.,low
162,208,2024-11-29 15:10:26,open,Beyond attention save than natural serious customer.,low
163,85,2025-04-07 22:51:27,in_progress,Outside adult generation lay what create best.,low
164,318,2025-01-14 09:45:53,closed,Again purpose majority raise.,low
165,286,2025-03-02 00:07:09,open,Administration southern question before.,medium
166,12,2024-09-23 00:14:28,closed,Down rest sell around type how.,high
167,729,2024-09-20 04:30:25,in_progress,Together partner process.,low
168,135,2024-10-04 06:36:38,closed,Up we ability hair.,high
169,570,2024-08-27 05:56:59,open,Nothing movement doctor road lose major here.,medium
170,297,2024-10-08 07:00:28,closed,Else agreement community.,high
171,171,2025-05-29 05:53:07,open,Budget run recent job.,medium
172,767,2025-06-30 22:10:36,open,Religious base also budget service over.,low
173,903,2025-01-14 11:25:06,in_progress,Or process lawyer ground heavy at enough spring.,medium
174,696,2025-02-04 20:32:43,closed,Provide hundred public consumer best.,high
175,484,2024-12-27 19:11:27,closed,For would person.,low
176,173,2025-04-09 15:28:09,in_progress,Any him force ever imagine simply against.,low
177,555,2025-05-13 18:22:54,in_progress,Tax effect help subject.,medium
178,970,2025-02-03 00:37:38,open,Medical must sit save.,low
179,386,2025-07-10 15:25:11,closed,Indeed weight spend girl read compare.,high
180,516,2025-03-18 20:04:11,in_progress,Particular thus special go expert.,low
181,529,2024-08-06 20:21:44,open,Space whom education view hope physical.,low
182,112,2025-03-26 13:58:38,in_progress,Fly individual move decide just concern.,low
183,239,2025-04-23 14:35:39,open,Control away kitchen public option school.,high
184,34,2025-05-18 02:01:20,open,Instead window future to team throughout.,medium
185,270,2025-04-23 04:03:36,open,Through factor century little mind interest read.,high
186,54,2025-07-02 02:23:20,open,Surface picture so candidate else.,medium
187,146,2024-10-14 02:48:46,open,Whom model raise Mrs least.,low
188,371,2025-03-28 10:58:03,in_progress,Draw majority from above.,medium
189,581,2025-06-01 15:42:44,open,Special beat from learn source successful hand.,medium
190,245,2024-09-26 21:54:17,in_progress,Country church station carry month government.,low
191,930,2024-09-06 14:50:13,closed,Fish kitchen herself behavior.,high
192,27,2024-11-14 20:14:23,open,Technology act politics crime after wall step.,high
193,162,2024-11-05 13:49:00,open,Hope government toward.,medium
194,780,2024-10-08 09:51:54,open,Loss get course wonder participant interview probably life.,low
195,957,2025-05-21 10:13:27,in_progress,Partner blue consumer particularly.,low
196,850,2024-07-28 04:46:56,in_progress,Beautiful town ten painting price window ok.,medium
197,543,2025-06-03 19:21:12,in_progress,Year him radio candidate research director.,high
198,25,2025-01-20 14:26:08,in_progress,Admit nation sing coach maintain.,high
199,73,2024-11-24 21:35:14,open,Beyond people only right relate response of truth.,high
200,612,2024-11-18 22:50:02,open,Face for every choice leg.,high
201,960,2025-04-27 11:36:26,open,Perform special find political none practice garden.,low
202,495,2025-01-24 19:20:16,open,Picture involve major.,low
203,266,2024-07-30 18:04:52,in_progress,Respond however yeah hospital sound add.,low
204,663,2025-06-19 20:44:57,open,Direction education civil different say available require design.,high
205,517,2025-02-12 10:31:01,in_progress,Personal indeed suffer majority above issue take.,low
206,885,2024-08-14 02:04:39,closed,Affect describe effort recent two experience.,medium
207,494,2024-11-03 18:05:55,closed,Alone later think wind stop Mr sister.,low
208,131,2025-05-15 03:54:06,closed,President throw staff evidence available.,low
209,743,2025-05-28 00:37:56,open,Study cost imagine window stand economy.,high
210,645,2025-02-25 21:24:00,open,Dream least score.,high
211,863,2025-01-26 16:00:54,in_progress,Religious consider challenge operation.,medium
212,214,2025-03-25 23:43:03,in_progress,Quality through most Congress movement.,low
213,595,2025-06-01 22:50:26,open,Ahead family with political nothing trial them.,high
214,994,2025-04-24 03:13:07,in_progress,Improve voice mention man Congress forward.,high
215,744,2024-09-30 09:46:20,closed,Say middle reason not identify condition.,high
216,512,2024-09-21 00:38:07,in_progress,Return significant character various data though.,medium
217,461,2025-06-11 05:30:27,open,Right himself phone example available wait.,medium
218,395,2025-06-07 09:47:03,open,Us approach month might out own fact church.,medium
219,281,2024-12-15 21:51:25,open,International time team admit technology.,high
220,868,2024-12-16 04:40:00,closed,Service across ground rest up tax who.,medium
221,163,2024-07-15 19:41:14,closed,Themselves red cut hear magazine specific.,low
222,707,2024-10-26 09:56:07,in_progress,Later stock south choice mean.,low
223,844,2024-07-31 16:04:13,in_progress,Explain billion morning PM.,low
224,775,2024-12-13 18:28:17,closed,Should war center political.,medium
225,679,2024-12-18 02:25:21,open,Last read hope occur.,high
226,73,2024-12-19 06:38:13,open,Choose image center only.,low
227,699,2025-05-19 15:21:03,open,Institution decision west general team animal interview.,medium
228,792,2025-05-09 17:58:34,in_progress,Future feel feel push blood south design.,high
229,500,2025-04-23 19:42:30,in_progress,Player ground prepare discuss.,medium
230,261,2025-03-28 06:10:09,in_progress,Arm group pattern.,high
231,435,2025-04-15 15:08:31,in_progress,Respond until movement which.,medium
232,172,2024-10-28 19:19:04,in_progress,Occur make sometimes approach.,medium
233,417,2024-11-09 20:43:09,in_progress,Benefit describe off writer community successful ok.,high
234,919,2024-07-21 05:56:40,open,Growth resource share could she public.,high
235,873,2024-07-27 12:03:49,open,Lot series western really.,low
236,333,2025-01-02 07:09:21,in_progress,Require media anyone quite century determine.,low
237,701,2024-10-16 15:46:37,closed,Tend offer full impact science prepare.,high
238,570,2024-08-18 10:29:35,closed,Center yes customer professional activity your soon.,low
239,464,2025-07-02 04:46:42,open,Major least art between purpose agreement.,high
240,432,2025-02-14 09:28:41,closed,Agency method growth.,low
241,841,2024-11-21 08:18:28,closed,Control modern tax.,high
242,373,2025-05-06 05:25:38,open,Throughout son plant five.,low
243,427,2024-09-05 09:32:28,open,Law view soldier.,high
244,988,2024-11-22 21:11:35,open,Former federal sell.,medium
245,321,2025-03-09 18:46:51,closed,Like them any in dog TV kitchen.,low
246,810,2025-07-01 07:26:19,open,Exist go course thought player success.,low
247,393,2024-10-23 09:47:05,in_progress,Spend compare reason skill.,medium
248,170,2024-10-28 21:31:36,closed,Sometimes return perform fight physical late dog.,high
249,576,2024-10-27 15:49:05,in_progress,Message west direction drug will little.,medium
250,435,2025-02-01 16:54:20,open,Another four relate happen spend.,medium
251,842,2024-12-18 04:22:01,open,Accept expert resource most kid difficult unit technology.,high
252,218,2024-11-15 11:47:18,closed,Will nearly heart.,high
253,466,2024-08-30 02:56:29,open,Standard close part feel system brother everyone side.,low
254,131,2025-01-11 21:23:11,closed,Leave somebody car local employee.,low
255,320,2024-10-29 16:38:48,closed,Research player woman building space sea science.,high
256,469,2024-08-27 10:56:25,open,Movement argue notice fill either.,high
257,819,2024-10-26 02:41:52,in_progress,Seven lot song media break organization.,low
258,893,2024-12-09 12:04:46,closed,Can whom thing money tax friend.,medium
259,841,2024-08-11 06:55:08,closed,Soon huge water happy.,low
260,917,2024-11-16 10:04:48,closed,Find big left Mr contain.,high
261,244,2024-12-16 06:45:59,in_progress,How rise candidate school project.,high
262,455,2025-03-02 14:34:23,open,Must already present drop medical item.,medium
263,935,2025-03-16 03:31:40,closed,Member would several.,low
264,180,2024-09-05 14:57:45,open,Goal no join local.,high
265,530,2024-11-16 12:42:19,closed,He reason issue message soon practice free.,low
266,238,2024-07-24 08:23:46,open,Enough free blood democratic but.,low
267,266,2024-08-16 23:50:14,in_progress,Myself money wide stop space now.,low
268,499,2025-05-15 10:36:14,in_progress,Body successful what woman.,low
269,858,2025-04-29 10:52:16,in_progress,Green various meet another everybody.,high
270,316,2025-05-10 20:12:50,closed,Pretty popular require factor drive these.,low
271,697,2024-10-23 22:52:17,in_progress,Control fund million seven community edge.,medium
272,825,2024-08-01 00:49:37,in_progress,Second heavy both door quite be.,medium
273,360,2025-03-05 00:18:04,in_progress,Charge hear director agency feeling.,low
274,804,2024-10-21 03:22:12,in_progress,Soon blue several size page hit woman.,low
275,766,2025-02-12 09:30:32,closed,Understand least artist yeah mean visit you.,low
276,466,2024-08-24 03:14:39,open,Stock without TV us entire.,medium
277,127,2024-09-10 04:32:23,open,Customer tax risk law another establish.,medium
278,730,2025-04-22 19:53:46,closed,Know happy consumer bag skin happy article suffer.,low
279,629,2025-04-21 16:33:59,in_progress,Standard large ago career.,high
280,590,2024-08-24 10:41:24,open,Close natural hospital yard serious project debate.,low
281,863,2025-05-08 10:05:57,closed,Answer effect number design with PM seven public.,medium
282,773,2025-04-16 02:00:49,in_progress,Else staff push black future clear job.,medium
283,758,2024-09-11 16:36:42,closed,Central challenge each street strategy score above investment.,high
284,906,2024-09-23 01:37:28,in_progress,Different read share process test heavy.,medium
285,809,2025-02-01 00:16:59,in_progress,Case me city bag method national.,high
286,553,2025-06-16 07:45:30,open,Never parent fear your.,medium
287,180,2025-03-23 12:54:44,closed,Cell special health system.,low
288,730,2025-03-29 08:34:43,open,Very wonder see eye picture new summer.,medium
289,549,2025-01-10 09:17:44,in_progress,Yourself leave unit type interest begin.,high
290,609,2025-06-25 18:48:24,open,Leader fall news foot might set.,low
291,591,2025-05-27 20:17:17,open,Shoulder education conference end international.,high
292,454,2025-01-09 07:56:47,in_progress,Government form account small.,medium
293,510,2024-09-23 12:07:19,open,Standard brother management relate.,low
294,701,2025-03-18 02:08:03,in_progress,Appear it arm guess address suddenly.,high
295,667,2024-12-17 22:09:48,closed,Market read marriage my east.,medium
296,750,2025-03-06 03:33:23,in_progress,My meet north suddenly individual a door.,medium
297,580,2024-09-04 16:13:51,open,Good its bring design.,high
298,730,2024-10-01 19:44:05,open,Interesting manage whom machine meeting probably though marriage.,medium
299,231,2025-04-26 07:04:50,open,Poor sort affect cultural action among.,high
300,436,2024-10-14 17:09:14,open,Them pick apply fast arrive husband.,low
301,240,2024-10-29 11:43:26,in_progress,Sort because under wide.,medium
302,111,2024-11-12 10:57:46,closed,Option policy person send safe.,high
303,925,2024-12-21 14:21:44,closed,Talk defense subject difference treatment.,high
304,627,2025-01-06 23:22:38,closed,Boy we citizen vote decision return thought example.,high
305,334,2025-05-31 00:32:13,in_progress,Cup prepare important light federal raise include Mrs.,high
306,153,2024-07-30 16:57:31,open,Human why important charge.,medium
307,544,2024-12-30 17:33:37,in_progress,A first group baby get series.,medium
308,604,2025-03-08 02:20:36,open,Suddenly industry Congress significant.,high
309,518,2024-09-22 12:51:31,in_progress,Commercial machine prepare write.,high
310,548,2025-03-16 07:59:46,closed,Season protect cultural age billion.,medium
311,926,2025-05-16 05:44:53,closed,Beautiful scene tough industry each.,high
312,313,2025-03-14 07:30:25,open,Should particular maybe born.,high
313,918,2024-11-03 07:27:41,open,Push year happen law road stay notice.,medium
314,870,2024-12-04 12:07:21,in_progress,Last she head work beyond as house choose.,medium
315,381,2025-05-23 14:51:55,open,War participant soon own around.,low
316,818,2025-05-07 13:06:48,open,During around billion trial buy.,medium
317,65,2025-04-09 17:27:32,in_progress,Scene them real soldier experience impact pass.,medium
318,455,2025-05-08 13:24:44,open,Necessary cold speech.,high
319,476,2024-09-25 00:10:25,open,Fund become range at American speak.,medium
320,758,2025-01-29 07:24:42,open,Resource military social one everybody actually.,high
321,189,2025-04-16 14:05:17,open,What camera maintain piece show back old.,medium
322,74,2025-07-11 10:37:12,closed,Serious some oil someone local.,high
323,309,2024-12-22 01:02:13,in_progress,Meeting thing sort newspaper guy.,low
324,332,2025-02-02 10:41:28,open,Religious former picture deep no high.,high
325,600,2024-08-25 04:16:53,closed,Authority sort growth look door.,high
326,18,2025-01-21 15:32:32,closed,Mention budget easy job apply point.,high
327,35,2025-06-11 20:09:22,in_progress,Down president training his.,low
328,263,2024-10-14 02:37:00,open,Tend win success seven.,low
329,577,2025-04-30 16:02:24,closed,Physical specific but adult.,medium
330,518,2024-07-18 13:00:12,in_progress,Parent outside thought do.,low
331,535,2025-05-11 15:07:16,in_progress,Task travel seem notice minute season.,high
332,990,2024-10-28 18:04:39,closed,The very watch film discover.,medium
333,974,2025-05-05 08:31:59,closed,Off floor lay.,low
334,816,2025-06-05 15:04:45,closed,Word color offer owner.,low
