ticket_id,customer_id,created_at,status,issue_description,priority
4608,763,2025-01-17 13:59:41,open,Support modern over movie.,low
4609,206,2025-04-14 04:04:18,open,Community charge site support material.,low
4610,846,2025-02-09 20:36:42,in_progress,Firm admit recognize expert.,medium
4611,404,2025-06-04 23:22:46,open,Maybe president occur read pay by get.,high
4612,603,2024-09-29 05:53:19,closed,Value feel necessary hope upon.,low
4613,422,2025-03-14 09:48:20,open,Low human shoulder report eat impact series.,medium
4614,345,2025-02-17 02:18:00,in_progress,Open game a anything.,low
4615,483,2024-10-15 22:45:47,closed,Describe pull continue.,medium
4616,8,2024-10-10 05:17:58,in_progress,Together significant enter book former minute major.,high
4617,625,2024-08-29 01:16:25,in_progress,Edge realize wind others reduce.,medium
4618,678,2024-07-18 15:57:07,closed,Plan money bar fear particularly.,medium
4619,990,2025-04-13 10:55:21,closed,Run join cup think.,medium
4620,285,2024-09-11 10:09:12,closed,Interest key my front pass economic.,low
4621,68,2025-07-07 06:02:30,closed,She husband lead wife.,medium
4622,843,2025-07-05 05:41:06,open,Other blood fill either.,medium
4623,368,2025-01-27 17:06:46,open,Energy benefit who together information.,high
4624,905,2025-05-08 23:54:07,open,Better third time who into exist policy.,low
4625,406,2024-11-04 15:16:34,open,Card along heavy article majority.,low
4626,434,2025-03-27 05:32:28,open,Send as loss wait.,medium
4627,549,2024-09-08 20:29:30,closed,Anyone court defense guess Democrat prove read.,low
4628,961,2025-01-28 14:18:15,closed,Model hand bill group stay.,low
4629,110,2025-02-12 05:09:25,open,Teach check floor baby.,low
4630,729,2024-08-10 10:37:26,open,Poor collection no get face test scene week.,medium
4631,473,2024-10-04 23:41:58,open,Against suddenly near.,low
4632,31,2025-03-13 21:59:05,closed,Scene arrive water spend behind fast enjoy.,high
4633,916,2024-08-13 15:45:14,closed,Central fast away reach wait.,low
4634,638,2024-10-31 00:01:14,in_progress,Born tough resource arrive under drop bar dog.,medium
4635,359,2024-09-02 09:47:58,in_progress,Office turn yet plan.,low
4636,582,2025-01-25 15:39:36,closed,Impact response team society compare environmental.,low
4637,149,2025-01-21 16:44:38,closed,Most team deal recently hit action.,high
4638,960,2024-09-23 23:37:10,open,Mrs even human offer church care also.,medium
4639,167,2025-06-24 08:49:48,open,Somebody reveal place safe interview.,low
4640,851,2024-10-28 13:00:25,open,News suffer year season value course.,high
4641,260,2024-12-27 15:03:06,open,Wife write recently already.,medium
4642,974,2025-06-23 17:38:08,closed,Since base weight hand design.,high
4643,227,2024-07-30 16:03:54,closed,Now bad some sure really security.,high
4644,999,2025-03-09 02:43:22,open,A matter message top.,high
4645,23,2025-06-19 12:27:02,open,Open person world politics.,medium
4646,150,2025-01-04 14:59:04,open,Affect game memory camera better.,low
4647,821,2024-12-28 20:35:52,open,None scene care just available beautiful live special.,low
4648,616,2024-10-15 19:03:08,open,Month help fund fly any ten phone.,high
4649,795,2024-10-05 08:28:55,open,Say identify send.,low
4650,278,2024-11-30 00:55:06,closed,Easy meet however realize.,medium
4651,715,2024-08-25 07:22:59,open,Example civil year little standard knowledge.,medium
4652,962,2025-02-13 02:37:59,closed,Per great interesting such present court.,high
4653,643,2024-08-15 03:14:02,closed,Father system bit market by position job arm.,low
4654,171,2024-10-31 08:00:42,open,Story far on along.,medium
4655,660,2025-04-10 18:26:26,in_progress,Feeling surface go learn.,low
4656,999,2024-12-04 06:44:32,in_progress,During American price itself.,high
4657,361,2024-12-24 13:47:30,in_progress,Career next great.,medium
4658,178,2024-08-02 22:14:30,open,Subject world beyond method.,low
4659,183,2024-11-11 01:15:16,open,Listen travel well season interview.,medium
4660,494,2025-02-08 14:56:29,closed,Especially always tend all.,high
4661,553,2024-10-26 23:17:07,in_progress,Cost mean pass exist learn fight too.,low
4662,39,2024-10-03 02:00:21,in_progress,Particular both plan career season throughout feeling.,medium
4663,222,2024-09-16 07:28:53,open,Television unit education outside state scene with.,medium
4664,186,2025-05-29 01:41:35,in_progress,Operation public help still much development hard.,medium
4665,785,2025-05-24 16:18:03,in_progress,Medical morning attorney five win send exist.,high
4666,419,2024-11-05 07:45:12,in_progress,The audience project specific relate car.,medium
4667,586,2024-09-03 16:20:50,in_progress,Step cultural drop prove.,medium
4668,957,2025-05-25 18:35:09,in_progress,Sound state put current behavior participant.,medium
4669,900,2024-10-23 13:11:20,open,Write rock notice else herself military determine.,low
4670,369,2024-11-10 14:34:42,in_progress,Probably study board coach.,low
4671,175,2024-12-25 07:07:58,closed,Expert upon friend.,low
4672,342,2024-09-12 16:43:56,in_progress,Possible generation rather.,low
4673,758,2024-12-29 22:10:23,closed,Image bring me yourself of despite information at.,high
4674,256,2024-12-14 11:23:13,closed,Dog sister necessary amount suggest prepare.,medium
4675,418,2024-11-29 17:38:21,in_progress,Many strategy wide road page election carry affect.,high
4676,770,2025-06-22 01:50:39,in_progress,Common successful similar hotel such subject.,medium
4677,874,2024-10-30 18:59:24,in_progress,Policy tend close machine.,low
4678,292,2024-08-29 11:54:18,open,Dark stay miss doctor need game effort stand.,low
4679,506,2025-07-08 12:17:48,in_progress,Available back century.,medium
4680,820,2024-07-31 13:52:16,in_progress,Central act inside debate.,low
4681,731,2024-11-28 14:34:19,closed,Easy bag water two rise choose.,high
4682,345,2024-09-12 19:16:04,closed,Imagine year general.,high
4683,522,2024-11-20 11:32:36,in_progress,Rather wide plan worry.,medium
4684,390,2024-08-15 03:20:22,closed,Happen let glass front step stuff forward.,low
4685,980,2024-09-14 20:28:23,closed,Growth cover per describe.,medium
4686,105,2025-04-29 19:54:02,open,Difference sound moment sometimes section probably.,low
4687,572,2024-09-21 16:26:29,in_progress,Perform call process others company lawyer gas very.,high
4688,179,2024-08-17 23:04:00,open,However drug fly trade mouth clear debate.,low
4689,278,2024-08-23 21:15:41,open,Institution east any.,high
4690,806,2024-11-04 13:06:43,in_progress,Everything save level entire floor technology.,medium
4691,892,2024-09-20 21:33:18,in_progress,Science reveal measure environment clearly although truth.,high
4692,459,2024-07-25 13:00:44,closed,Feel nation standard fine politics others.,medium
4693,965,2024-07-11 12:37:44,closed,Stock peace somebody else professor statement.,low
4694,158,2025-07-07 18:22:30,in_progress,Trouble stuff station firm always seem.,medium
4695,933,2025-02-18 08:32:30,closed,Yourself method describe seem create mouth third.,medium
4696,552,2024-08-03 02:33:57,closed,Area financial in between.,medium
4697,64,2025-03-15 19:07:45,in_progress,Business entire ready by agree car car.,medium
4698,101,2024-08-17 01:01:20,in_progress,Lose owner current star arm range.,medium
4699,68,2024-08-03 16:52:23,closed,Ever popular read year near Mr garden.,medium
4700,783,2024-08-24 13:15:53,in_progress,Mind top always discussion fight thousand new.,medium
4701,245,2024-10-13 21:23:32,in_progress,Republican available eye certainly contain morning these.,medium
4702,398,2024-11-20 06:34:51,closed,Need really reveal present fill for college.,high
4703,384,2024-11-07 19:33:41,closed,Available leave activity stage until analysis player.,low
4704,731,2024-07-13 12:04:13,in_progress,Career special similar real individual affect although.,medium
4705,97,2025-01-14 17:51:55,closed,You federal rest collection point its party.,medium
4706,267,2024-08-25 18:58:49,closed,Head develop certain already land after.,low
4707,118,2025-02-01 00:49:02,in_progress,Film second property.,low
4708,7,2025-04-18 11:19:22,open,Throw capital leader smile partner.,high
4709,990,2025-06-15 02:13:30,closed,Yard each growth example member may ok.,low
4710,916,2024-12-13 16:08:03,in_progress,Debate operation trip article spring issue quality.,medium
4711,773,2025-02-23 08:17:16,open,Current chance throughout hair.,medium
4712,747,2024-08-18 13:25:08,closed,Gun participant financial.,low
4713,128,2025-07-08 21:34:49,open,Military likely bit defense.,medium
4714,596,2024-08-16 16:38:01,closed,Way create where less outside.,medium
4715,899,2025-07-08 06:15:59,closed,Military nature long bad hot peace.,medium
4716,731,2025-01-20 23:50:04,in_progress,Information wonder music relationship break.,high
4717,420,2025-06-02 22:31:09,open,Suffer push early approach end back.,high
4718,170,2024-12-19 00:47:04,in_progress,Dinner you push campaign ago road research.,low
4719,410,2025-04-01 19:57:27,closed,Turn wrong accept sell form we.,low
4720,557,2024-07-31 11:01:01,closed,Interest if modern.,low
4721,593,2024-08-26 19:38:28,in_progress,Say child machine.,high
4722,329,2024-09-25 07:50:00,in_progress,Perhaps subject enjoy stay crime decide.,low
4723,763,2025-06-02 01:26:23,open,Single cup life more place very.,medium
4724,534,2025-02-26 08:36:35,closed,Significant character away range raise.,low
4725,809,2025-05-14 19:20:30,in_progress,Any show image task road student.,medium
4726,286,2025-03-30 01:44:25,open,North wear most little than kid.,high
4727,357,2025-01-13 07:11:57,open,Door whom answer likely learn.,medium
4728,650,2025-06-08 03:06:27,open,Local benefit company house style four.,medium
4729,335,2024-12-12 14:48:39,closed,Challenge forward to money in back.,medium
4730,9,2024-09-18 15:48:43,open,Down surface tax life she bank.,low
4731,706,2025-05-29 05:12:05,in_progress,Contain her argue television green economic.,low
4732,646,2024-07-16 14:45:44,open,Role Mr argue reach.,medium
4733,211,2025-01-26 10:53:28,in_progress,Stop nature degree up first.,high
4734,605,2024-12-14 11:59:33,open,Return least return contain throw throughout upon.,medium
4735,781,2024-08-21 06:41:32,open,Gun drug American training.,high
4736,692,2024-12-25 20:25:00,in_progress,Other point reason seek.,high
4737,407,2025-01-21 23:14:07,in_progress,Box beautiful eight likely medical.,medium
4738,677,2025-02-08 19:01:10,in_progress,Drug single American off peace including power.,medium
4739,325,2024-12-24 18:16:40,in_progress,Too as walk modern near door around.,medium
4740,459,2025-05-06 08:09:16,closed,Only figure student last many.,low
4741,678,2024-08-23 05:16:11,closed,Theory authority item.,low
4742,334,2024-09-17 21:55:28,open,Age less economy piece realize appear shake season.,medium
4743,131,2025-06-03 06:37:34,open,Response color will image.,low
4744,875,2024-12-09 05:00:22,open,Product situation daughter hour trial look draw.,high
4745,837,2024-07-22 07:46:43,open,Buy when ask growth simply federal.,high
4746,926,2025-07-11 02:49:42,closed,Large woman Republican court teach.,low
4747,302,2025-05-29 02:08:02,in_progress,Discussion right will.,low
4748,450,2025-05-07 12:19:27,open,Condition two later something enjoy prepare hand.,medium
4749,674,2025-06-28 04:04:13,in_progress,Western forget eat must indeed hold.,medium
4750,323,2025-06-14 10:41:01,open,As ready eat material.,high
4751,573,2024-11-03 00:44:57,in_progress,Organization meet ahead arrive quickly almost.,medium
4752,515,2025-01-08 10:18:50,closed,Policy director here.,medium
4753,508,2025-01-03 05:20:01,in_progress,General always quite movie occur include strategy.,low
4754,5,2025-04-23 02:43:19,closed,Politics important rest shoulder decide.,low
4755,881,2024-12-04 05:39:14,closed,Really dream realize number past her however.,medium
4756,250,2024-09-05 19:59:45,in_progress,Order little particular attorney of senior.,low
4757,824,2025-06-14 16:35:24,open,Road available purpose evidence method.,high
4758,808,2025-05-31 03:58:42,open,Professional agreement economic present thing it case.,low
4759,822,2025-03-27 21:32:25,open,Information administration enough party appear play different.,high
4760,823,2025-04-17 06:11:49,closed,Building worker how will hold treatment.,medium
4761,805,2025-02-22 01:19:24,open,Suggest current wait some nothing laugh.,high
4762,639,2024-09-13 22:53:53,open,Actually court ever note end.,high
4763,425,2025-03-12 14:37:46,closed,Quite share of show weight.,medium
4764,47,2025-06-06 23:06:42,in_progress,Which citizen new seven.,medium
4765,364,2025-03-20 14:13:03,in_progress,Perhaps lead impact one large energy name.,high
4766,908,2025-06-10 18:10:32,closed,Provide hope dream sea.,high
4767,541,2025-04-15 05:02:03,in_progress,Drop significant best.,low
4768,496,2024-09-14 12:19:41,in_progress,Human key return analysis left.,low
4769,362,2025-05-18 17:08:43,closed,Treatment nature laugh food water.,high
4770,590,2024-12-13 14:52:39,closed,Traditional phone per.,high
4771,903,2025-02-08 09:43:18,in_progress,Many marriage fall apply memory.,low
4772,65,2024-10-11 01:16:44,in_progress,Task heart establish wonder Congress material.,medium
4773,101,2025-01-31 09:19:12,in_progress,Teacher various themselves.,high
4774,189,2025-04-05 14:29:12,in_progress,Make including idea.,medium
4775,87,2024-12-05 08:19:43,in_progress,Fine include management cause environmental form woman.,high
4776,501,2024-07-13 22:53:43,open,Quickly its threat system sell.,high
4777,178,2025-02-16 03:20:10,in_progress,Difference result central choose town officer.,medium
4778,272,2024-12-28 06:38:16,closed,Big stage marriage save.,high
4779,349,2025-04-30 00:02:34,open,Many drive life easy center particularly social.,low
4780,208,2025-05-31 03:09:00,closed,Grow consumer great political final to likely cause.,low
4781,356,2025-03-07 18:05:21,open,Collection carry raise her word kitchen.,medium
4782,178,2025-01-29 22:01:22,closed,Week town clearly reach table guess.,medium
4783,807,2024-12-29 23:35:19,in_progress,News machine gas heavy go organization partner.,medium
4784,49,2025-05-25 21:57:07,open,Pretty where century note writer technology general.,high
4785,321,2024-12-23 02:49:36,in_progress,Hard type specific economy then.,low
4786,910,2025-06-14 17:20:14,closed,Hand city foreign maybe life recognize.,medium
4787,23,2025-04-05 02:21:07,closed,Year water though bank believe firm bad person.,low
4788,766,2024-11-20 11:08:51,open,Body economic issue religious because.,low
4789,34,2025-01-14 13:02:46,open,Population seem present ball no.,medium
4790,329,2025-01-08 11:38:23,in_progress,Couple administration sit gas have data.,medium
4791,273,2024-11-30 14:23:21,in_progress,Maybe religious break whom.,high
4792,529,2025-05-03 15:29:20,closed,Put scientist sound now international.,low
4793,204,2025-04-29 06:01:30,open,Tonight which detail wonder for trial best.,medium
4794,621,2025-05-05 16:20:40,closed,Factor establish pattern cell eight.,high
4795,380,2025-07-07 19:47:49,in_progress,Treat and offer no.,high
4796,604,2025-05-21 20:36:44,open,Important occur at surface how forward.,medium
4797,280,2025-02-16 12:54:14,closed,Media technology better her owner.,medium
4798,461,2024-12-22 01:55:30,in_progress,College local not including.,medium
4799,783,2025-02-23 13:37:20,closed,Family surface him technology.,low
4800,132,2025-03-04 08:53:20,open,Follow despite consumer.,medium
4801,122,2025-05-30 06:41:45,closed,Around wife talk politics but represent.,low
4802,482,2025-04-11 16:13:25,open,Win against best boy coach.,high
4803,95,2025-02-21 20:41:29,open,Hair risk sport top gun yard per.,low
4804,978,2024-08-05 12:43:33,open,Use either scene ok.,low
4805,51,2024-08-06 21:10:36,open,I region she push career total fund.,low
4806,213,2024-10-14 07:10:39,closed,Want near movement.,high
4807,539,2024-12-19 10:38:44,closed,Push writer trip significant benefit person relate.,low
4808,474,2025-04-29 23:44:47,open,Relationship give sell how including before recognize.,low
4809,358,2025-03-17 14:30:43,closed,Such two eight well court.,high
4810,217,2024-09-17 06:59:33,closed,Once senior record.,low
4811,770,2024-11-27 23:52:09,closed,Society very three area pressure.,low
4812,803,2024-07-21 11:27:00,closed,Speak consumer visit.,high
4813,73,2024-09-30 05:21:10,in_progress,Remain character glass lot particularly.,low
4814,625,2025-06-02 02:38:38,in_progress,Exist itself law dream style cover suggest.,high
4815,913,2024-12-31 14:05:50,closed,Always particular radio new.,high
4816,702,2024-10-03 10:03:02,closed,Fear simply generation speech.,medium
4817,5,2024-11-07 22:20:27,closed,Practice believe might school such per.,high
4818,912,2025-02-27 03:42:14,open,Where up usually especially option else low.,low
4819,532,2025-07-05 22:01:51,in_progress,East human value understand.,low
4820,778,2024-10-25 04:53:47,open,Child top charge window.,high
4821,442,2025-06-28 03:51:37,closed,Site case few to feel keep late.,low
4822,160,2025-06-11 22:44:32,closed,Red difficult action quickly stay election we.,low
4823,183,2024-07-12 17:00:53,in_progress,Sport pass act artist lay father police.,medium
4824,892,2025-04-13 06:04:17,open,Growth measure go three gun big.,high
4825,806,2024-07-19 03:06:13,in_progress,After pressure benefit knowledge art.,low
4826,943,2025-03-27 10:47:25,open,Pretty fish firm provide.,medium
4827,28,2025-04-29 00:04:43,in_progress,Throughout argue serious necessary interesting support who.,low
4828,27,2025-05-02 09:23:21,closed,Power take none draw onto program bring sure.,medium
4829,344,2024-10-19 10:50:49,closed,Next fine after bank various wind decision.,low
4830,907,2024-09-12 09:37:29,closed,Main test few instead free fear.,low
4831,854,2024-07-20 03:22:14,in_progress,Spend approach three.,medium
4832,659,2025-01-02 05:33:35,closed,Now above strong lot water beat tonight war.,low
4833,992,2025-02-23 03:24:43,in_progress,Single writer forget future week structure think.,high
4834,980,2025-06-08 16:26:59,in_progress,Rock instead minute.,medium
4835,334,2024-11-16 01:26:06,open,Not art value marriage science claim seven.,medium
4836,237,2025-01-29 04:55:59,open,Region analysis next hit expert resource interest.,medium
4837,138,2024-12-17 07:37:10,closed,State natural sense partner great Mr consumer shoulder.,high
4838,784,2025-06-05 23:30:44,in_progress,Successful behind local player.,high
4839,743,2024-12-02 22:24:57,closed,Her well understand firm my book reveal.,high
4840,2,2025-03-28 11:53:15,open,Might war personal edge would wind spring many.,low
4841,108,2025-02-05 13:51:08,open,Join actually less she.,high
4842,85,2025-04-12 08:49:59,open,Step consider least everything of someone to.,high
4843,650,2024-12-24 06:24:36,in_progress,Surface account leader realize share offer.,high
4844,944,2024-08-08 22:00:50,open,Get college read yard.,low
4845,696,2024-12-15 04:57:14,in_progress,Peace including manage likely question.,medium
4846,649,2025-01-09 09:23:57,in_progress,Friend ten fast low behind.,high
4847,596,2024-11-05 01:29:59,in_progress,Like card themselves will find score.,medium
4848,360,2025-04-09 21:34:16,open,Tax group more.,medium
4849,800,2024-12-25 08:00:02,in_progress,General movie another through.,high
4850,129,2025-05-24 13:07:50,in_progress,Religious meeting card industry building know goal.,high
4851,510,2025-04-28 06:43:24,closed,Including people experience raise current.,high
4852,454,2024-11-28 18:10:05,open,Because politics five painting perhaps industry outside.,high
4853,933,2025-02-23 12:02:55,open,Key dog last whatever white use matter.,medium
4854,888,2024-08-16 15:29:31,open,Feeling deal article idea treatment rest rate image.,low
4855,269,2025-06-01 08:35:30,open,Identify very son carry feeling bad cost.,low
4856,36,2024-11-25 01:25:09,open,Employee resource main forward future water person.,medium
4857,159,2025-01-14 17:19:21,open,Among something state our hotel help.,medium
4858,809,2024-10-23 14:18:53,in_progress,Picture country school.,low
4859,375,2024-12-13 22:11:16,open,Some report entire degree.,low
4860,5,2024-07-26 07:03:41,closed,Minute than boy.,medium
4861,743,2024-10-30 17:30:54,in_progress,Yet success hundred gun market.,low
4862,241,2024-08-25 15:22:35,in_progress,Actually still sound size common pattern with.,low
4863,116,2025-03-22 10:00:54,closed,Raise hit beyond history past issue.,high
4864,698,2025-02-05 23:31:01,closed,Without far across popular final read do.,high
4865,436,2025-01-07 10:33:20,closed,Then industry do produce campaign.,medium
4866,194,2024-08-17 23:36:31,in_progress,System unit message community boy.,high
4867,908,2024-08-21 18:38:25,in_progress,Director shake body.,low
4868,191,2024-12-24 04:19:22,open,Already outside time according artist.,low
4869,791,2025-01-18 15:35:25,closed,Often buy bar senior international lot throw.,low
4870,437,2025-06-14 01:34:04,closed,Make morning worker concern thank right wear.,high
4871,72,2025-02-06 23:25:38,in_progress,Language would seek rule ok whose.,low
4872,698,2024-10-13 10:25:28,open,Base use nice yeah.,low
4873,637,2025-04-21 20:57:49,open,Lawyer garden need focus.,medium
4874,372,2024-10-15 10:52:34,closed,Note history leader company.,high
4875,210,2025-02-18 06:02:34,in_progress,Identify sure instead involve every.,high
4876,670,2024-09-02 22:42:02,open,Tonight sport customer head vote peace.,medium
4877,169,2024-08-17 03:38:19,closed,Area practice already tell.,medium
4878,834,2025-02-13 00:46:40,open,Participant claim subject stop whatever dog none.,low
4879,899,2024-10-07 00:06:28,closed,Save set style ball specific Mr over.,medium
4880,165,2025-03-09 12:55:36,in_progress,Own PM though source avoid.,high
4881,172,2025-02-11 13:59:42,closed,May should finish think back.,high
4882,507,2025-04-05 13:09:29,in_progress,Their various economic experience read president system.,medium
4883,63,2024-12-14 23:32:42,in_progress,Worry Republican across share very.,low
4884,624,2025-03-18 20:43:22,in_progress,Civil on threat fight whose last beautiful start.,medium
4885,451,2024-12-28 05:16:35,in_progress,Feel do room really.,low
4886,759,2024-09-09 20:24:25,open,Project choose interest level section professor however.,medium
4887,668,2025-04-01 00:40:07,open,Mission budget sense sort ground.,high
4888,639,2025-05-30 05:18:00,open,Fly throw report rich while on contain.,high
4889,825,2024-08-18 04:46:01,open,Economic if level.,low
4890,82,2024-09-09 22:32:14,open,Subject value prove quality although official.,low
4891,608,2024-11-13 01:14:29,open,Final most various enter.,low
4892,132,2024-07-18 06:58:37,closed,Night smile enjoy become federal bit.,high
4893,697,2025-02-02 11:38:19,open,Indicate understand none operation recognize difficult improve others.,medium
4894,658,2024-11-30 15:41:06,closed,Live table some least also step woman.,low
4895,398,2025-07-05 02:00:02,in_progress,Various commercial travel wall decade front.,medium
4896,602,2025-07-01 03:59:25,closed,Glass owner next peace beat foreign.,high
4897,341,2024-12-08 17:01:29,in_progress,That admit interest score method religious.,high
4898,229,2025-07-08 08:08:42,closed,When executive will staff.,medium
4899,534,2024-12-23 06:16:42,closed,Body majority attorney child do suffer election help.,medium
4900,895,2024-07-23 00:22:15,closed,Feeling employee race their thousand fly.,high
4901,561,2025-03-11 11:53:55,open,Radio response reflect market.,low
4902,126,2025-05-11 14:15:42,closed,Able behind pretty attention.,medium
4903,683,2025-02-24 04:08:04,closed,Name expect music subject quickly.,high
4904,243,2025-06-25 10:14:57,in_progress,Seem national family newspaper notice.,medium
4905,772,2025-05-13 18:25:45,open,Defense population unit imagine financial direction first.,low
4906,751,2024-09-14 01:16:13,in_progress,Group past level lawyer.,medium
4907,852,2025-01-16 07:51:55,closed,Deep nearly happy everybody stage whom movie.,medium
4908,442,2025-06-28 08:07:04,in_progress,Until institution evidence decade story.,high
4909,397,2025-04-07 02:35:43,closed,Relationship site himself around no.,medium
4910,389,2025-07-08 16:06:26,in_progress,Score cut though force.,high
4911,547,2024-09-02 20:01:13,closed,Trouble watch remain kitchen physical four.,medium
4912,876,2025-02-09 13:48:53,in_progress,Action everything war fall development put.,low
4913,559,2025-03-14 07:49:49,closed,Night government course son account continue general.,high
4914,412,2024-07-26 10:56:17,closed,Different such card likely arm.,low
4915,366,2025-06-23 22:26:58,open,Different chance organization discover lay.,medium
4916,435,2024-11-02 03:34:33,open,Friend open them prevent recent history region.,low
4917,636,2024-07-24 05:52:50,open,Who various fact year land.,high
4918,303,2025-02-16 05:59:15,closed,Fact bad million buy more.,low
4919,905,2025-06-14 09:04:41,open,Team something after few garden despite recently worker.,high
4920,237,2024-12-31 18:43:48,in_progress,Part four administration staff.,high
4921,89,2025-03-19 09:15:37,closed,Church simply scientist before discussion.,high
4922,365,2024-12-13 11:15:08,closed,Large movie suddenly coach whose.,medium
4923,368,2024-11-27 05:24:12,closed,Pass skin blood.,medium
4924,527,2025-03-28 20:57:36,open,Heavy happy final in little.,high
4925,305,2024-09-01 06:05:37,in_progress,Possible find wide receive.,low
4926,702,2024-09-25 05:39:14,closed,Result sort month prepare.,high
4927,307,2025-05-12 10:32:22,in_progress,Whether win station important.,high
4928,853,2025-03-12 22:07:13,in_progress,Morning by popular large score seek.,medium
4929,896,2024-10-25 05:53:38,closed,Design direction program apply certain.,medium
4930,69,2025-05-27 19:13:02,closed,Mother foot suffer throw also tree.,medium
4931,160,2025-06-23 00:52:34,open,Note agreement space role pick.,low
4932,601,2024-08-21 00:40:55,closed,Growth job sport heavy.,medium
4933,591,2025-06-24 03:55:42,in_progress,Crime wind environmental hard bring other compare.,low
4934,726,2025-04-08 12:24:51,in_progress,Player plan industry long left fall tax area.,medium
