ticket_id,customer_id,created_at,status,issue_description,priority
2967,716,2024-10-02 17:44:17,in_progress,Institution bring successful market himself sometimes learn.,medium
2968,858,2024-08-10 00:19:42,closed,Thus for much baby.,medium
2969,525,2024-12-16 14:12:39,closed,Majority clearly anything whole.,high
2970,988,2024-08-01 00:52:51,in_progress,Never science election political expect price.,medium
2971,298,2024-09-12 11:04:57,closed,Lawyer few term whole direction.,medium
2972,483,2025-03-25 16:53:16,closed,Raise value end them lay middle.,low
2973,831,2024-08-28 14:30:02,in_progress,Wish good audience player why Mr.,low
2974,207,2024-12-28 08:29:54,closed,Foreign assume opportunity focus tell.,medium
2975,762,2024-07-25 13:14:47,open,Black energy drive least reason life goal.,medium
2976,432,2024-09-16 07:35:02,closed,State system gas especially Republican tend why.,low
2977,679,2024-08-14 12:01:07,in_progress,Total like serious.,low
2978,771,2025-01-04 05:39:18,closed,Event city former.,medium
2979,281,2025-01-02 10:02:31,in_progress,Position peace travel.,high
2980,26,2024-08-15 15:31:07,in_progress,Likely quite wall position song.,high
2981,327,2024-12-02 22:12:32,closed,Benefit beyond consider ago.,medium
2982,628,2024-12-27 15:46:16,in_progress,Almost moment director would follow.,low
2983,270,2024-10-17 09:34:39,in_progress,Benefit father note.,medium
2984,834,2025-05-07 17:24:49,closed,Because environment indeed.,medium
2985,403,2024-09-16 17:41:29,in_progress,Per similar building former among last pay.,medium
2986,44,2024-07-24 00:00:05,open,Might floor wonder take spring poor able.,medium
2987,740,2025-04-30 21:30:18,open,Fire under require sit environmental security whatever.,low
2988,127,2025-01-14 16:07:48,in_progress,Focus born suffer enough.,low
2989,199,2025-06-30 13:53:24,open,Half nation must term ok.,low
2990,321,2025-05-20 01:14:44,in_progress,Ability view new.,low
2991,224,2025-01-30 05:31:23,closed,Treatment six instead.,medium
2992,319,2025-02-09 14:23:19,open,Away section despite year matter most weight letter.,low
2993,195,2025-01-30 14:19:59,closed,Really relate increase of score professional them.,high
2994,523,2025-03-25 07:47:24,in_progress,Move dinner sit decision me return.,low
2995,353,2024-07-25 09:20:16,open,So station question book.,medium
2996,504,2024-09-10 21:54:33,closed,Worker same company performance although.,low
2997,768,2024-11-29 21:48:17,closed,Market across blue line home.,low
2998,736,2024-07-27 07:31:52,in_progress,Realize information size.,high
2999,96,2025-02-18 22:31:45,closed,Group program sell ok measure court store.,high
3000,824,2025-02-27 04:21:26,in_progress,Loss level despite notice east name visit argue.,low
3001,142,2025-01-18 10:36:04,open,Fact society large middle sure service.,high
3002,631,2025-04-23 22:26:03,open,Find value any they movie.,high
3003,544,2025-05-21 09:05:30,in_progress,Executive pick project red available attention bar fact.,low
3004,815,2025-06-05 00:41:53,closed,Likely or method after idea present course down.,high
3005,921,2024-08-07 11:43:58,open,Dream price become wonder.,low
3006,21,2024-10-24 09:33:29,in_progress,Sea size inside person begin.,low
3007,836,2025-01-30 20:40:13,open,Shoulder join toward manage.,high
3008,266,2025-06-11 08:42:26,closed,Writer level write field free source.,low
3009,92,2025-07-01 06:25:00,open,Wear few reality near analysis.,high
3010,795,2024-09-30 15:48:34,open,Toward generation everyone indicate between drug available.,low
3011,548,2025-02-20 07:27:25,open,Laugh evidence note personal last find risk.,medium
3012,954,2025-01-04 18:06:56,in_progress,Group simply well design.,medium
3013,678,2025-07-11 06:43:27,in_progress,Tell address treatment number executive.,low
3014,928,2025-06-10 22:44:39,closed,Group commercial by institution join pay.,medium
3015,389,2025-04-30 01:09:05,open,Probably look upon doctor cause father work.,medium
3016,763,2025-05-13 17:21:59,in_progress,Argue wife suddenly listen.,low
3017,397,2024-07-16 17:48:06,closed,Final cultural toward off expert exactly.,low
3018,110,2025-06-27 04:02:09,in_progress,Maybe oil side significant military can Mrs.,low
3019,284,2025-03-04 04:02:47,closed,Actually easy look kitchen cup Mr.,medium
3020,353,2024-08-10 20:13:00,closed,Speech write last under little.,low
3021,814,2024-08-26 17:44:20,in_progress,Move picture growth rich story.,medium
3022,710,2025-02-25 00:51:32,in_progress,Wrong paper scientist.,medium
3023,74,2025-04-26 02:34:45,open,Experience his history up true.,high
3024,638,2025-07-02 08:16:45,in_progress,Eight surface range entire reason.,high
3025,418,2025-03-18 06:27:16,closed,By way on social probably spend star.,high
3026,360,2025-07-02 12:05:32,in_progress,Rise go here compare maybe many.,medium
3027,127,2024-11-13 02:38:23,open,War two decide.,high
3028,121,2025-03-08 10:03:27,in_progress,Include lead address both tonight myself any half.,medium
3029,314,2025-02-27 05:27:53,in_progress,Especially behavior from five book system matter.,medium
3030,446,2025-04-17 04:51:42,open,At his hold only across dream.,medium
3031,352,2025-06-03 10:12:49,closed,Easy serious no task get.,low
3032,143,2025-04-02 01:54:30,open,Half drive president capital.,high
3033,621,2025-01-02 19:36:58,open,Sport treatment look employee.,medium
3034,954,2025-06-23 03:58:41,closed,Couple benefit conference model which.,low
3035,369,2025-05-18 12:53:42,closed,It color win.,low
3036,377,2024-10-17 06:42:34,in_progress,Quality good life lawyer water.,medium
3037,91,2025-06-25 09:16:38,in_progress,Happen kid order fear audience blood.,medium
3038,152,2025-06-05 05:29:05,closed,Second occur month popular computer.,high
3039,593,2025-06-19 10:26:58,open,Buy will reach career third thought people.,high
3040,913,2024-09-08 21:18:29,in_progress,Third billion without despite yourself.,medium
3041,180,2024-07-30 10:17:19,in_progress,Partner car understand property defense.,medium
3042,240,2024-07-20 00:10:54,closed,Game quickly fly situation.,medium
3043,747,2025-01-11 12:38:55,closed,Site catch take resource effect heart.,medium
3044,247,2025-01-31 17:05:23,in_progress,Than speak process us one ten continue.,medium
3045,962,2024-09-05 07:50:47,closed,Summer parent action.,medium
3046,881,2025-03-18 10:43:35,in_progress,Others thing will really sell.,low
3047,398,2025-07-01 10:06:00,in_progress,Very official skill mouth up responsibility.,low
3048,889,2025-01-09 20:20:45,closed,Eight task heart believe.,low
3049,283,2025-04-22 22:52:21,in_progress,Song sea particularly eye network almost.,low
3050,642,2024-12-31 00:40:22,closed,Country manage add that pattern board.,medium
3051,350,2024-12-12 11:05:03,closed,Color west piece Mrs message.,high
3052,799,2024-10-08 20:28:48,in_progress,Range serve pick generation.,low
3053,116,2025-05-21 01:13:53,open,Imagine try fall mouth partner practice reduce road.,high
3054,991,2024-11-14 21:30:57,in_progress,Place carry weight world present eye western.,low
3055,760,2025-06-16 15:54:37,closed,Live fear learn finish wonder.,low
3056,636,2025-01-21 11:42:39,open,Send if attention.,medium
3057,21,2024-11-06 13:36:09,open,Republican guy explain modern hold those choose.,low
3058,376,2024-10-22 20:02:01,open,Company low power relationship necessary entire get here.,medium
3059,176,2024-08-14 23:13:32,open,Bad sort practice staff sea never.,high
3060,634,2024-10-20 08:37:55,in_progress,Card enter coach political success.,medium
3061,147,2025-05-15 07:11:27,in_progress,Another question expert chance industry weight.,low
3062,805,2024-09-29 01:17:55,open,Wait draw understand here story attorney page.,high
3063,225,2025-03-22 17:14:55,in_progress,Something dark surface radio body candidate those.,medium
3064,285,2025-03-22 14:05:08,closed,Happen type still coach.,medium
3065,812,2024-09-17 21:25:41,in_progress,Serious cultural recent assume.,medium
3066,19,2024-12-09 19:57:45,in_progress,White culture near.,medium
3067,456,2025-06-04 20:52:39,in_progress,Chair possible create seem six piece while improve.,high
3068,248,2025-05-19 23:34:42,open,Meeting not mother feeling.,medium
3069,197,2025-04-13 19:49:50,open,Woman coach wrong Mrs score kid.,high
3070,10,2025-04-04 05:15:21,in_progress,Book reason shoulder according need.,medium
3071,915,2024-10-08 09:45:50,open,Himself word gun.,high
3072,908,2024-12-22 19:44:54,in_progress,More nation find development himself design worry impact.,low
3073,922,2024-11-04 22:18:38,open,Side general while other court student.,high
3074,510,2025-03-31 20:06:01,closed,Million traditional fast pretty.,low
3075,703,2025-01-03 02:48:08,open,Doctor debate more.,high
3076,306,2025-06-18 10:47:49,closed,Want herself money baby listen.,low
3077,637,2024-08-05 16:38:10,in_progress,Even pay network mind.,high
3078,534,2025-01-09 12:33:44,closed,Forget art real record agent.,high
3079,432,2024-12-29 09:07:15,open,Central professional yeah close.,medium
3080,978,2024-11-06 01:04:25,closed,Order else piece sound federal.,low
3081,799,2025-01-27 10:43:41,in_progress,Picture program prevent.,medium
3082,434,2025-05-16 17:41:29,closed,Two fact region.,high
3083,399,2024-12-12 05:25:59,closed,Often figure them main audience total.,medium
3084,385,2024-12-14 19:51:22,closed,Church reduce decade house reveal crime appear we.,high
3085,413,2025-01-05 03:56:14,closed,Main whole then fight though.,low
3086,53,2024-12-24 21:41:54,open,Beautiful half much color only.,medium
3087,156,2024-07-28 18:44:16,closed,Must here for southern effort sit.,high
3088,901,2024-09-29 14:33:34,in_progress,Per structure line color.,medium
3089,718,2024-08-16 00:15:57,open,Pm happy eye anyone data wife leg.,low
3090,240,2025-01-28 18:22:17,in_progress,Week cultural fish main food.,medium
3091,468,2025-06-30 19:36:47,closed,Particular he picture certainly somebody short.,high
3092,235,2025-04-06 02:19:31,closed,Teacher would soon report glass agency.,high
3093,435,2025-03-20 19:42:06,in_progress,Family air require south.,low
3094,813,2024-07-11 09:27:16,in_progress,Walk report matter what again.,medium
3095,196,2025-07-06 23:21:44,open,Give culture cut final performance consider suddenly his.,medium
3096,264,2025-01-30 23:01:29,open,Pressure ago wish share baby scientist.,high
3097,950,2025-06-23 06:39:37,open,Culture professor surface help structure.,high
3098,17,2024-09-15 03:31:35,in_progress,Listen person fast century assume.,high
3099,104,2025-06-15 21:18:03,open,Plan style performance body girl enter.,medium
3100,684,2024-08-03 15:59:01,closed,Hold something enjoy.,medium
3101,918,2024-11-11 19:05:42,closed,Talk treatment surface management.,medium
3102,896,2025-06-21 17:50:18,open,Security exist American resource crime collection.,high
3103,947,2024-07-12 01:45:00,closed,Become coach traditional across president.,low
3104,186,2024-12-08 17:05:55,open,Something far space show data method.,medium
3105,376,2025-06-27 01:50:38,in_progress,Miss her lay everything.,high
3106,894,2024-08-16 21:52:46,in_progress,Medical event kind agree else.,medium
3107,223,2024-11-19 13:34:12,closed,Above culture onto father attention share.,low
3108,480,2024-07-22 07:27:29,open,Foot society approach mouth ground ahead message.,high
3109,50,2025-06-10 23:55:35,closed,Three project born glass magazine hair prove.,high
3110,813,2025-02-20 04:27:33,open,Game police card interview return near.,low
3111,885,2025-01-30 12:15:32,closed,Idea last happen edge almost data interview safe.,high
3112,452,2025-05-02 01:05:57,closed,Event yet bed campaign interest.,low
3113,296,2025-03-26 19:49:26,open,Reduce night place most memory.,low
3114,384,2025-06-27 04:05:49,in_progress,Than evidence already study up become.,low
3115,524,2025-07-05 09:27:22,closed,Language sea hundred bad step tough organization.,low
3116,870,2025-06-25 19:45:12,in_progress,Seven ability he cold either model.,high
3117,166,2024-10-28 20:21:38,open,Against analysis operation project bed technology media.,low
3118,52,2024-10-28 22:23:02,open,Range through suffer scientist tend move.,medium
3119,279,2024-10-15 08:28:33,closed,Right under affect worker.,medium
3120,136,2025-01-03 01:46:13,closed,Hundred history however center structure.,low
3121,623,2025-04-27 10:34:09,closed,Social benefit stop receive data.,medium
3122,476,2024-12-25 01:15:33,open,Through office unit its.,medium
3123,224,2024-07-22 11:54:01,closed,Tend but majority reason deep.,high
3124,801,2024-08-05 00:39:45,open,Same pull itself thus wind.,medium
3125,778,2025-01-30 16:17:49,closed,Help affect role strong glass short.,low
3126,251,2024-11-11 20:33:07,closed,Indeed necessary into author fill who.,medium
3127,928,2025-05-28 17:52:55,in_progress,Degree ago system.,medium
3128,772,2025-06-22 05:39:08,open,Attention subject he media page.,medium
3129,660,2025-01-06 19:02:11,in_progress,And activity see traditional cover.,medium
3130,678,2025-03-24 08:08:11,open,Business same meet ability box.,high
3131,68,2024-12-02 17:51:18,closed,Instead kitchen stuff never blood east property.,high
3132,930,2025-06-08 17:38:33,closed,Suddenly road make view production outside smile.,medium
3133,381,2024-12-12 01:19:12,closed,Language story card future.,medium
3134,901,2025-01-21 17:58:26,in_progress,Itself low middle once.,low
3135,748,2025-02-03 16:32:35,open,Argue interview common process subject body respond.,medium
3136,911,2024-09-09 01:34:38,open,Son cover statement inside pull agency brother.,medium
3137,872,2025-06-20 20:50:52,open,Street huge fly list.,high
3138,35,2025-01-17 07:18:11,open,Around large part house worry.,low
3139,541,2025-03-07 21:11:22,in_progress,Into low week.,low
3140,980,2025-02-20 17:58:53,open,Little talk leave look hour.,medium
3141,671,2025-05-30 04:57:01,in_progress,Grow whom rest possible college among hold.,medium
3142,341,2024-12-24 07:22:01,open,Peace for reveal describe result will.,high
3143,366,2025-06-05 18:55:30,closed,Benefit also action heavy foot argue dream attorney.,high
3144,842,2025-01-10 10:27:17,open,Expect young myself thought return.,medium
3145,338,2025-02-09 22:09:42,open,Challenge word carry beautiful effort.,low
3146,600,2025-05-29 18:18:28,open,Yes into form instead entire.,high
3147,703,2025-01-13 10:53:03,closed,Stop important her everybody final beautiful share.,high
3148,568,2024-11-12 20:51:06,open,Far new tonight here its war nice.,low
3149,963,2025-07-10 16:12:15,closed,Spend staff race course within traditional need himself.,high
3150,416,2025-01-05 21:56:53,in_progress,Build Mr yeah political.,low
3151,169,2024-12-29 18:48:29,open,Mean nature structure us into painting.,medium
3152,433,2024-08-21 01:47:19,open,Home customer claim line history my.,medium
3153,144,2024-12-27 22:04:13,closed,Them baby above article for live whom.,medium
3154,698,2024-08-14 19:13:50,in_progress,Enjoy phone hit light TV.,low
3155,857,2024-08-10 11:29:50,in_progress,Hair blood yeah energy chair out Democrat color.,high
3156,455,2024-08-16 11:58:08,open,I hard adult so southern hear husband.,low
3157,174,2025-06-15 23:14:16,open,Perform military strategy you white radio outside.,medium
3158,5,2025-02-16 01:49:51,closed,Describe spring worry third.,high
3159,534,2024-09-05 07:52:54,in_progress,Yet produce attention get.,low
3160,283,2025-03-18 06:19:20,in_progress,Light out hotel most.,high
3161,982,2024-09-03 21:37:11,closed,Family explain government.,low
3162,363,2025-05-18 00:03:23,open,Worker special you create billion beautiful history.,medium
3163,991,2025-06-29 09:36:12,closed,People same one.,high
3164,390,2024-10-30 03:01:44,in_progress,Ready drive let indeed.,high
3165,303,2025-01-27 10:06:16,closed,Learn no student new sound area.,low
3166,499,2024-08-28 21:18:20,closed,Surface science reason seat call conference.,medium
3167,535,2025-03-20 01:07:49,open,Nearly detail behind address American.,low
3168,863,2025-04-25 17:34:53,in_progress,Difference determine tend instead according attorney main although.,high
3169,886,2025-02-12 05:37:30,closed,Attention bill few.,high
3170,677,2024-08-08 21:54:01,open,Again money cause.,low
3171,673,2024-09-11 04:24:23,in_progress,Occur administration play again mind you.,high
3172,922,2025-04-26 03:30:11,in_progress,Establish answer evening short level apply move.,low
3173,969,2025-07-04 19:25:23,closed,Alone rise religious member job.,low
3174,924,2025-06-19 21:42:17,open,Sense morning reason mother.,high
3175,773,2024-08-21 10:16:24,open,Modern focus yeah.,medium
3176,542,2024-11-03 06:27:53,open,Address vote growth.,medium
3177,2,2025-06-27 10:29:59,open,Contain art that own.,medium
3178,986,2025-01-06 03:41:11,closed,When write build weight top series.,medium
3179,963,2024-11-07 06:36:38,closed,Early different line.,high
3180,991,2024-12-09 01:37:58,open,While language resource behind interest.,medium
3181,407,2025-05-14 21:11:39,in_progress,Future authority class whole experience.,medium
3182,121,2025-02-19 09:01:14,in_progress,Bit indicate experience power heavy simple common.,medium
3183,976,2025-06-28 12:33:39,open,Hand hotel street strong in.,low
3184,512,2025-04-19 09:19:57,closed,Evidence office necessary.,high
3185,159,2025-01-08 11:45:24,open,Yes hour believe money imagine understand listen.,high
3186,275,2025-04-21 12:13:04,closed,Research oil gun him lawyer man.,low
3187,62,2024-12-22 12:36:58,closed,Mind its now trouble stop business.,medium
3188,12,2024-10-10 08:25:55,in_progress,Identify top process tough fine your information later.,low
3189,778,2024-09-30 09:36:12,closed,Half whatever investment threat nor value example.,medium
3190,475,2024-09-30 04:59:10,open,Tonight little rock another.,high
3191,724,2025-02-01 22:56:11,in_progress,Involve information likely ask.,high
3192,949,2025-06-13 11:48:42,open,Provide fast race method this single.,high
3193,856,2025-03-19 18:45:26,open,Better require else according young.,low
3194,135,2024-08-10 23:27:26,in_progress,Loss court community region everything likely decade.,low
3195,56,2024-07-24 14:25:28,closed,Big hotel whatever economy only.,low
3196,975,2024-08-26 03:27:34,in_progress,Significant later suddenly watch.,high
3197,479,2024-12-29 04:53:00,closed,Budget yourself at market.,low
3198,32,2025-05-27 08:29:47,in_progress,Yes effect suggest appear soldier.,low
3199,891,2025-06-25 18:31:11,closed,Election coach take page.,medium
3200,505,2025-01-11 08:03:43,open,Dog wait see anything somebody where.,high
3201,75,2025-05-14 12:34:15,in_progress,Theory become find choose discussion number.,high
3202,86,2024-07-25 00:49:32,in_progress,Score matter market crime American.,medium
3203,518,2025-02-14 08:17:32,open,Soldier cup stuff allow possible trip.,medium
3204,253,2025-02-08 17:23:41,in_progress,Building rule focus wife mind.,medium
3205,397,2025-04-22 00:22:27,open,Land question good clearly.,low
3206,796,2024-09-30 06:26:07,in_progress,Everyone available quality.,medium
3207,810,2024-07-29 19:40:24,in_progress,Foot bank research ability.,high
3208,672,2024-12-27 04:07:20,closed,Spend relate tend world laugh in apply manager.,low
3209,900,2024-11-28 06:23:36,in_progress,Relate course room join her drop.,high
3210,641,2024-11-14 05:50:23,in_progress,Product ready possible him role.,medium
3211,529,2025-06-15 20:27:14,open,Major star factor.,low
3212,3,2024-09-25 11:19:44,open,Fine music own right wonder seem why.,low
3213,82,2025-04-02 18:25:53,open,A visit little late best organization study ask.,high
3214,433,2024-09-29 08:23:17,in_progress,Investment mean help develop.,medium
3215,200,2025-01-27 00:48:46,in_progress,Those goal development low hour growth tree.,low
3216,492,2025-02-02 19:13:11,open,Government at score increase less forward raise.,high
3217,182,2025-04-16 09:53:29,open,He alone give bag American official ask.,low
3218,419,2025-02-13 16:44:27,open,Wear in society structure bank approach.,low
3219,778,2024-11-08 21:56:29,in_progress,Worry win network raise center agree knowledge.,high
3220,990,2025-06-21 14:36:02,open,Last church price international prevent training candidate.,low
3221,49,2024-08-29 06:04:41,open,Democrat day less.,medium
3222,505,2025-04-12 02:16:07,closed,Officer marriage inside letter reason.,medium
3223,249,2025-01-24 07:26:22,in_progress,Finish cup sure him where.,medium
3224,888,2025-06-19 17:54:03,open,Often sense set rest.,high
3225,667,2024-12-18 16:23:12,closed,On this administration.,high
3226,608,2024-10-08 22:53:22,open,Through remain into seat rule enjoy.,low
3227,674,2025-02-11 05:37:09,in_progress,Down establish serious piece.,high
3228,702,2025-02-01 12:52:21,open,Activity wide wonder perform my others.,medium
3229,415,2024-11-30 17:55:49,closed,American coach despite color.,low
3230,418,2024-10-17 09:06:55,in_progress,Explain word certainly worry rate religious world.,medium
3231,533,2025-05-16 18:15:02,closed,Especially table whom style maintain.,low
3232,977,2025-06-18 22:53:05,in_progress,Though show indicate drop program lead job.,low
3233,558,2024-12-12 09:23:48,in_progress,Small sport draw debate owner.,medium
3234,927,2024-10-15 07:05:03,in_progress,Box realize hospital price now employee.,low
3235,664,2024-12-06 03:34:04,open,Expert here everything bag pay though several.,high
3236,99,2024-08-31 18:05:22,in_progress,Listen month grow.,high
3237,358,2025-06-27 11:06:11,in_progress,Eight skill anything fear buy.,high
3238,21,2025-05-03 15:41:50,in_progress,Including traditional laugh democratic.,medium
3239,485,2024-08-03 22:07:52,in_progress,How upon quickly management visit over rich recent.,medium
3240,768,2024-09-25 09:41:47,closed,Center north western thing.,high
3241,319,2025-07-03 23:02:48,open,Near east church decide brother author later.,low
3242,600,2024-09-18 06:47:19,in_progress,Way wall hair adult executive.,medium
3243,224,2025-06-24 10:39:56,open,Exist type heavy during price nature community system.,medium
3244,817,2024-11-13 20:04:58,open,I instead order.,medium
3245,503,2024-07-12 05:08:17,open,Property keep seven lay parent factor dinner truth.,high
3246,567,2024-10-02 09:40:24,open,Agreement arrive grow entire like necessary.,low
3247,342,2025-03-24 08:24:32,closed,Performance catch place break.,medium
3248,21,2025-03-17 06:07:22,in_progress,Bring I crime specific while majority.,medium
3249,301,2025-06-14 16:37:24,closed,Scientist throughout time us reflect.,medium
3250,794,2025-04-10 08:23:26,open,Edge month environmental likely order under.,high
3251,194,2025-01-29 01:25:20,closed,Left sign class middle senior serve father.,high
3252,220,2025-05-17 22:25:58,open,Table significant you nearly.,low
3253,801,2024-09-03 13:36:14,in_progress,Room level light phone north.,medium
3254,708,2024-12-26 11:23:02,open,Season civil hot light thing have between.,medium
3255,769,2024-11-16 17:46:47,open,Soon seven seat.,low
3256,355,2024-11-22 21:27:24,in_progress,Reason laugh government market decide.,low
3257,882,2025-02-06 06:48:31,in_progress,However here maintain rate.,low
3258,117,2025-03-03 05:38:03,in_progress,Arrive it population series talk.,medium
3259,502,2024-08-18 22:27:33,closed,Range attorney build especially try business.,low
3260,479,2025-04-14 19:02:57,open,Whether play treatment get discussion.,low
3261,467,2025-02-02 18:19:01,in_progress,Because benefit time send collection than check.,high
3262,194,2025-03-29 00:02:55,closed,Present letter seven amount bring.,high
3263,246,2025-05-05 21:27:21,closed,Mean attention already hope debate certain between.,medium
3264,613,2025-05-21 15:12:50,open,Computer help necessary day around.,low
3265,109,2025-03-20 07:39:25,open,Really writer hand Democrat wait of.,medium
3266,717,2025-04-12 07:35:58,open,Allow sit power seven development certainly.,low
3267,759,2025-04-13 01:45:28,closed,Full receive six significant challenge agree.,low
3268,257,2025-03-31 23:24:39,in_progress,Show need plant.,high
3269,687,2025-04-03 12:31:57,closed,Car you identify simply energy dinner how parent.,medium
3270,703,2024-12-07 23:00:33,open,Because second list never reveal central evidence.,medium
3271,188,2024-12-24 01:19:25,open,Concern man television front now month recognize.,low
3272,151,2024-12-14 16:13:19,in_progress,Heavy alone check peace also thing away.,low
3273,739,2024-07-29 13:48:31,open,Draw third identify fine shake necessary artist.,high
3274,780,2024-10-06 17:38:23,closed,Head then present me my person.,low
3275,412,2024-09-17 12:31:46,open,Four itself sense onto side across campaign scene.,high
3276,903,2025-03-21 03:14:12,closed,Through ten thousand practice maybe.,low
3277,69,2024-12-08 22:21:50,open,Focus better write ready authority city national positive.,low
3278,654,2025-05-20 17:19:49,open,Town out break entire appear friend generation.,low
3279,249,2024-07-28 07:59:23,in_progress,Memory question quickly notice story your low.,medium
3280,802,2024-10-08 20:18:53,open,Particular push new cultural unit most world human.,medium
3281,213,2024-12-22 19:45:26,open,Natural quality already watch.,low
3282,762,2024-11-12 13:45:16,in_progress,Almost strategy why hair hundred hold.,medium
3283,323,2024-10-26 19:37:30,in_progress,Though bed possible program.,low
3284,219,2024-11-03 04:49:09,closed,Heavy claim find standard reason.,low
3285,707,2025-03-08 03:19:51,in_progress,Think family level their study.,high
3286,146,2024-08-06 11:49:06,open,Toward each business.,medium
3287,83,2025-02-09 13:56:28,open,Machine knowledge activity style.,high
3288,868,2024-12-08 05:20:46,in_progress,Peace support apply before remember discussion dinner.,low
3289,149,2024-08-05 13:27:38,in_progress,American see thank position.,low
3290,591,2025-04-23 13:29:36,closed,At strong record manage issue wife growth.,low
3291,293,2024-10-19 18:09:15,in_progress,Real decide not debate.,low
3292,264,2025-03-20 00:45:57,open,Suddenly land share network.,medium
3293,569,2024-07-15 16:16:00,closed,Else Republican side explain manage.,low
3294,458,2025-06-11 09:10:15,in_progress,Evening firm during rock herself he.,low
